URL,Title,Date,Text
https://www.bbc.co.uk/news/articles/c04vqzp6x31o,Reform councillor's firm fined over illegal worker,2025-12-08T17:43:32.957Z,"Reform councillor's firm fined over illegal workerImage source,LDRSImage caption,Andrew Harrison said the worker did have the right to work in the UKByBill EdgarNorth East and CumbriaPublished8 December 2025A Reform UK councillor's business was fined Â£40,000 for hiring an illegal worker, it has been revealed.Andrew Harrison, who represents Seaham in County Durham, received the penalty after his company Churchills Management Ltd was ruled to have employed someone who did not have a legal right to work in the UK.However Harrison, who was elected to Durham County Council in May, said the individual was legally allowed to work and his business was ""fully compliant"" with the appropriate paperwork for all employees.He said he was appealing against the Home Office penalty notice which was issued in February at Newcastle County Court. A Reform UK spokesperson declined to comment.On social media Harrison said: ""I have put the Home Office on notice and took legal action against them regarding this matter that will be heard next year and has been ongoing for a few months.""'Lowest move'Churchills was listed among several North East businesses fined earlier this year by the Home Office for employing illegal workers.Harrison said: ""I support illegal workers being removed and businesses being held to account to stop this illegal activity for self gain.""Business owners that abuse the system should be jailed.""Most people will not know this, but until the election this year, I was part of a specialist team actually carrying out enforcement and flying illegals out of the UK.""On the the legal case, he said: ""It is crystal clear that this is a targeted attempt to get money from small businesses.""With a country on its knees this is probably one of the lowest moves I have experienced.""No common sense or any appetite to stop wasting taxpayers' money on court proceedings.""TheLocal Democracy Reporting Service,externalunderstands the employee's Indefinite Leave to Remain expired in October 2023, but was extended after an application was lodged.The request was confirmed on 4 October, with Harrison's businesses not employing them until 10 October.By the time of the fine, the employee was in the process of extending her status in the UK, with a fee waiver being granted in November 2024.The Home Office says employers can face unlimited fines and up to five years in prison if they hire people who do not have the right to work in the UK.Follow BBC North East onX,external,Facebook,external,NextdoorandInstagram,external.Get in touchDo you have a story suggestion for BBC Wear?Contact formContact formRelated topicsUK immigrationHome OfficeSeahamReform UKDurham County CouncilRelated internet linksHome Office"
https://www.bbc.co.uk/news/articles/c709r8ekn8no,60 delivery riders face deportation after illegal work crackdown,2025-12-05T05:08:08.616Z,"60 delivery riders face deportation after illegal work crackdownImage source,Getty ImagesByOttilie MitchellÂandÂSimon JonesPublished5 December 2025The government says 60 takeaway-delivery riders found to be working illegally in the UK are facing deportation.The Home Office says the group are among 171 riders arrested over seven days in November in a national ""enforcement blitz"" in villages, towns and cities across the country.It comes as Home Secretary Shabana Mahmood has been targeting people working unlawfully in the ""gig economy"".Border Security Minister Alex Norris has also met representatives from food-delivery firms to encourage them to do more to tackle the issue - such as using facial recognition checks to prevent riders sharing their identities with people who do not have permission to take up work in the UK.Norris said November's action ought to ""send a clear message: if you are working illegally in this country, you will be arrested and removed"".He added: ""We are tightening the law to clamp down on illegal working in the delivery sector to root out this criminality from our communities.""The Home Office highlighted the cases of two Chinese nationals arrested at a restaurant in Solihull, four riders of Bangladeshi and Indian nationality in Newham, east London, and three riders of Indian nationality in Norwich. Seven of them were ""detained for removal"", it said.Click to expandTap the questions belowHow many people are returned or deported from the UK?The government requires people who are in the UK, but no longer have permission to live or work in the country, to leave.This is called a return and can happen voluntarily or involuntarily.People can lose the right to be in the UK for different reasons, such as a visa expiring, an asylum claim being refused, or by receiving a criminal conviction that results in deportation.There were 36,457 returns from October 2024 to September 2025. This was up by 11% on the same period the previous year.That number of returns is equivalent to about 5% of total emigration from the UK from July 2024 to June 2025.Who is returned from the UK?Of all returns from October 2024 to September 2025:5,343 had been convicted of a criminal offence10,958 had lodged an asylum claim at some point2,272 had arrived in the UK by small boatPeople from India made up 24% of all returns from October 2024 to September 2025.What is the 'one in, one out' deal with France?The UK istrialing a scheme with Franceto return people who arrived in the country on a small boat.For every person the UK sends back to France, the UK will accept an equal number of asylum seekers.This is called the ""one in, one out"" deal. As of 27 November 2025, 153 people have been returned through this arrangement.How do people leave the UK under immigration control?Returns can happen in different ways. ""Enforced returns"", which includes deportations, means the government arranges transport to return people to a different country. In some cases, people are escorted by officers.All other returns are ""voluntary"". This means a person has agreed to leave and may receive government help with travel and other costs to help facilitate the return.Some people classed as leaving the country voluntarily do so completely independently and withoutany government knowledge or involvement.Independent returns made up 33% of the total from October 2024 to September 2025.See more key stats on hotels, small boats and asylumAsylum seekers are generally not allowed to undertake paid work during their first 12 months in the UK, or until their asylum application is approved.But earlier this year the Sun newspaper reported that Channel migrants were able to rent accounts from legitimate delivery firm workers via social media groups.The government said at the time that ""illicit account sharing"" had been facilitating illegal work.The Home Office says it has recently been sharing the locations of asylum hotels with food delivery companies so they can ""monitor hotspots for illegal working"".Deliveroo, Just Eat and Uber Eats say they have increased randomised facial checks to ensure riders match their account names.The Home Office added in a statement that it had made 8,000 arrests last year for illegal working - a 63% rise on the previous 12 months.The Border Security, Asylum and Immigration Bill introduces new laws to expand right to work checks to the gig economy, including on delivery riders.Though asylum seekers cannot work in the UK during their first 12 months in the country, they are allowed to volunteer.In September, Mahmood proposed thatvolunteering would become compulsoryfor them to be granted permanent settlement status.But more than 300 charities wrote anopen letter,externalto the Home Secretary last month saying they would not comply with these proposals, calling the move ""exploitation"".Related topicsTakeaway foodHome OfficeImmigrationMore on this storyFood delivery apps to tighten checks to stop illegal workersPublished30 JuneIs the government meeting its pledges on illegal immigration and asylum?Published6 days agoTrack UK's latest migration numbers - including asylum, visas and small boatsPublished2 hours ago"
https://www.bbc.co.uk/news/articles/cq50n5pd2ejo,Paralegal sacked after offering to help dodge Â£60k illegal working fines,2025-11-18T00:28:34.238Z,"Paralegal sacked after offering to help dodge Â£60k illegal working finesTo play this video you need to enable JavaScript in your browser.This video can not be playedMedia caption,Watch: Undercover filming of alleged negotiation to fix a fineByEd Thomas,ÂUK editor,ÂPatrick ClahaneÂandÂRebecca WearnPublished18 November 2025A paralegal who was secretly filmed telling a BBC undercover reporter how he can help businesses avoid fines of up to Â£60,000 for employing illegal workers, has been sacked.At a solicitor's office in Huddersfield, Zohaib Hussain said he could ""make documents"" including ""business agreements"" for a fee of Â£3,500 to help dodge immigration fines.His employer, RKS Solicitors, confirmed he had been ""permanently dismissed"" a day after the investigation was broadcast and a ""police report"" had been made.Mr Hussain previously said he categorically denied ""all allegations, insinuations, and claims"".The Home Office announced an ""urgent investigation"" involving the National Crime Agency and multiple police forces following a series of BBC reports into organised criminal networks operating on High Streets the length of Britain.They exposed how a Kurdish crime network isenabling migrants to work illegally in mini-marts across the UK.Our investigation also uncovered a man at the centre of an immigration crime group who said he had""customers in every city""and could enable illegal working.Following the reports, senior politicians warned that the crime networks wereacting as a pull factor for illegal migration to the UK.Questioned by the BBC on whether the government has lost control of High Streets to Kurdish organised crime gangs, Home Secretary Shabana Mahmood said: ""What your reporters were able to scrutinise and show is absolutely evidence of why our system is broken.""It's why this government has been cracking down on illegal working.""In one of the investigations, an undercover reporter posed as a mini mart owner who had received a fine from immigration enforcement worth up to Â£60,000 for employing illegal workers, and met with Zohaib Hussain.During the meeting at a solicitor's in Huddersfield, Mr Hussain fired questions at our reporter about his cover story.""How many illegal workers? So how much is the fine? How many times did they catch you?""Then, with a chuckle, he asked what was sold in the mini-mart: ""Do you sell vapes? Legal or illegal? Bit of both as well?""Mr Hussain went on to explain how to avoid the fine.  He said: ""Sometimes we might have to make documents,"" said Mr Hussain, such as ""business agreements"".Our undercover reporter then asked if the fine would be transferred to someone else's name. Mr Hussain said that would be ""the last resort.""Before the meeting ended, Mr Hussain warned that the immigration authorities would want to jump on the fine straight away - making a cutting-motion across his throat.He said his charges would be Â£3,500 and he ""would look after us"".During the whole meeting with Mr Hussain, a man known as Shaxawan was present in the room.Shaxawan was revealed by the BBC as a man at the centre of an organised crime network involved in the facilitation of illegal working.He told undercover journalists that he and his associates could help migrants - including asylum seekers - to set up businesses illegally and ""confuse"" immigration enforcement.In Companies House listings, Shaxawan is named as Kardos Mateen, a British resident in his 30s, and has been the director of 18 businesses across the north of England, including many High Street mini marts.To play this video you need to enable JavaScript in your browser.This video can not be playedMedia caption,Watch: BBC News go undercover to film 'Shaxawan'Mr Hussain asked our undercover reporter to share any future Immigration Enforcement letters with Shaxawan.In a previous statement to the BBC, Mr Hussain said: ""For clarity, the individual named in your correspondence, Mr Shaxawan Jawad, is not associated with me in any capacity; professional, personal, or otherwise.""He added: ""I have never been involved in, nor have I facilitated, encouraged, or condoned, any form of illegal or improper activity.""Shaxawan, otherwise known as Kardos Mateen, told us by email that he categorically denied ""every allegation, insinuation and claim made"" in our reporting, and said that he was ""not employed by, associated with, or acting on behalf of RKS Solicitors in any capacity"".In a earlier statement, RKS Solicitors said it had informed the Solicitors Regulation Authority (SRA).""Mr Hussain is employed as a paralegal under strict supervisionâ¦ The individual is not authorised or instructed to provide immigration and tax advice.""The firm did not comment on Shaxawan Jawad. It said it did not condone unlawful conduct and was committed to the ""highest standards of professionalism, integrity, and public service"".West Yorkshire Police said it ""is working in close partnership with the Home Office, which has assumed primacy for the investigation into the matters highlighted in recent BBC reporting"".Related topicsOrganised crimeRefugees and asylum seekersUK High StreetsMore on this storyCriminal network behind UK mini-marts enables migrants to work illegally - BBC investigationPublished5 NovemberMini-mart crime network a 'pull factor' for illegal migrants, say MPsPublished5 November"
https://www.bbc.co.uk/news/articles/c0mpzpv3mw7o,Illegal workers caught during e-bike crackdown,2025-11-26T06:16:18.758Z,"Illegal workers caught during e-bike crackdownImage source,South Yorkshire PoliceImage caption,South Yorkshire Police have crackdown on e-bikes in Sheffield city centreByLucy AshtonSouth Yorkshire political reporterPublished26 November 2025Immigration officers have joined police patrols after a number of takeaway delivery riders on e-bikes were found to be working illegally.South Yorkshire Police targeted e-bikes in Sheffield city centre and discovered ""a significant number of asylum seekers with no right to work"" were delivering food and others were victims of modern day slavery.Food delivery couriers are self-employed and log on to apps to be able to collect takeaway orders.Just Eat, Uber Eats and Deliveroo said they had strict employment policies and worked closely with the Home Office and police. All three apps use daily facial recognition to verify couriers, among other checks including Right to Work documents.Verification checks are intended to prevent registered couriers ""renting out"" their accounts to those who do not have the right to work in the UK.In a report, South Yorkshire Police said: ""Since January 2024, the city centre neighbourhood team has seized over 200 e-bikes and e-scooters, with approximately 10% of those seizures leading to further arrests for more serious offences such as drug supply and possession of offensive weapons.""This approach also uncovered that a significant number of asylum seekers with no right to work were being employed as delivery riders and also potential victims of modern slavery.""The city centre policing team conducts weekly targeted operations to tackle anti-social behaviour, with e-bikes being a strand of this.""This is subject to daily patrols and regularly has more concerted days of action with immigration officers and plain clothed officers. The modern slavery team have also been involved in the joint operations.""The report, to the South Yorkshire Police and Crime Panel, said other police teams including Doncaster's were now looking at the same approach.Image source,South Yorkshire PoliceImage caption,South Yorkshire Police have seized more than 200 e-bikes and e-scootersUber Eats said it had a ""zero tolerance"" to modern day slavery and was the first platform to launch an identification system which requires couriers to take a ""selfie"" before a shift, which is then compared in real time with a photo in its database.A spokesperson said: ""We are deeply committed to tackling illegal work and the criminal networks who are often behind it.""We are continually improving our processes, including introducing industry-leading facial verification technology.""Our rules are clear that couriers must follow the law, including the Highway Code, and we have measures in place to help ensure couriers use appropriate vehicles.""All riders with Deliveroo, including substitute ones, complete up to four facial recognition checks per day. A team is dedicated to stopping criminals from co-ordinating illegal work.A spokesperson said: ""Deliveroo has taken action to target illicit account sharing on our platform and as a result, have off-boarded thousands of suspicious rider accounts in recent months.""Just Eat said it was fully committed to tackling all attempts to provide delivery services illegally.A spokesperson said: ""We have substantially strengthened our systems against abuse, with daily facial recognition checks, and checks that are triggered when a new device is used to log in.""Safety is taken seriously. All couriers delivering on our behalf must agree to follow all laws and rules of the road and any breaches are met with swift action and zero tolerance for criminal behaviour.""CrackdownThe Home Office said Deliveroo, Uber Eats and Just Eat would now receive information concerning the locations of asylum hotels to help better target people working illegally.In August, the Home Office said there were 280 arrests nationwide following a week-long crackdown on riders working illegally for delivery firms.Immigration enforcement teams targeted illegal working hotspots, with a focus on migrants working as delivery riders.As a result, 53 individuals were having their asylum support reviewed, which could result in it being suspended or withdrawn.Get in touchTell us which stories we should cover in YorkshireContact formContact formListen to highlights fromSouth Yorkshire on BBC Sounds, catch up with the latestepisode of Look NorthRelated topicsDeliverooElectric bikes and scootersTakeaway foodSheffieldUberJust Eat TakeawayMore on this storyScores of e-bikes and scooters seized in cityPublished26 JuneForce needs more police officers - deputy mayorPublished20 NovemberResidents back MP on e-bikes 'threat' warningPublished31 July 2024"
https://www.bbc.co.uk/news/articles/cjw95lyyp0vo,Council battles illegal land work near nuclear site,2025-11-17T06:15:03.038Z,"Council battles illegal land work near nuclear siteImage source,GoogleImage caption,The land is opposite the Atomic Weapons Establishment's Aldermaston siteByNiki HinmanLocal Democracy Reporting ServicePublished17 November 2025A council is planning action over an illegal development near a nuclear weapons site.Work has been carried out on land opposite the Atomic Weapons Establishment's Aldermaston campus despite a temporary stop notice, West Berkshire Council said.It said the ""scale and intensity of the activity"" had distressed residents in the Aldermaston and Tadley areas.An online petition said construction machinery was operating from 06:00 GMT until nearly midnight with a view to building static homes.The petition, which has attracted more than 300 signatures, said the work had left people feeling ""unsafe, anxious, and unprotected"".It added: ""We urgently need intervention to stop further environmental harm, prevent unregulated development, and ensure the well-being of residents.""Criminal inquiry into special needs teaching firmPublished14 NovemberCrime commissioners speak out over scrapped rolesPublished14 NovemberPair face extradition over man's disappearancePublished14 NovemberThe landowner put in a planning application on 3 November for 13 plots, the council said.The temporary stop notice was issued the following day.However, unauthorised works continued over the weekend, the authority added.It added: ""We fully understand how distressing this has been for nearby residents.""[Those] who witness threatening behaviour or feel unsafe should contact the police.""The authority said it was discussing safety issues with both Thames Valley Police and the Ministry of Defence Police.Get in touchDo you have a story BBC Berkshire should cover?Contact formContact formRelated topicsAldermastonTadleySee alsoAtomic weapons site safety procedures 'improved'Published8 AugustWhat is AWE and why does it need emergency alerts?Published11 JuneCouncil wins court ban on illegal encampmentsPublished29 MarchRelated linkWest Berkshire Council"
https://www.bbc.co.uk/news/articles/c5ypk7zjg84o,Arrests of illegal workers nearly double in Wales,2025-10-29T17:23:22.148Z,"Arrests of illegal workers nearly double in WalesImage source,Getty ImagesImage caption,More than 590 arrests of people suspected of working illegally were made by Immigration Enforcement between October 2024 and September 2025ByMark PalmerWales assistant editorPublished29 October 2025More than 590 arrests of people suspected of working illegally have been made in Wales over the past year, the Home Office has said.The arrests were made by Immigration Enforcement between October 2024 and September 2025.The Home Office says this marks a 98% increase on the year before and was part of the ""largest crackdown on illegal workers since records began"" after an uplift of immigration raids on businesses across Wales and the UK.Home Secretary Shabana Mahmood, said: ""Those found to be illegally working in beauty salons, car washes and as delivery drivers will be arrested, detained and removed from this country"".Illegal immigration and smuggling blitz sees 50 arrestsPublished27 OctoberIllegal nail bar jobs offered despite clampdownPublished20 December 2024Lack of immigration legal aid 'emotional torture'Published20 AprilWhat do the figures show?More than 8,000 illegal migrants were detained across the UK within the past 12 months,according to the latest immigration enforcement figures.,externalThis was an increase of 63% on 2023-24 across the UK, while south west England and Northern Ireland were the areas seeing the largest proportional rises.Arrests in Wales included seven Chinese nationals at a construction site on the Gower earlier this month.There were three illegal working arrests at a barbers in Porthmadog last month and a visits to warehouses in Caldicot in August resulted in eight illegal working arrests.There was a 95% rise in the number of illegal working visits in Wales by enforcement officers.The nationwide operation resulted in more than 1,050 foreign nationals being removed from the UK over the same period.The UK government said it was ""expanding right-to-work checks"" into the so-called gig economy ""where there are higher levels of illegal migrants seeking work"".Its Â£5m crackdown targeted businesses who often rely on casual or temporary workers, including fast food takeaways, beauty salons and car washes.The Home Office said it aims to ""shrink the black economy and penalise rogue employers who ignore immigration rules"".'Chronic mismanagement'Ms Mahmood, said: ""Illegal working creates an incentive for people attempting to arrive in this country illegally. No more"".""I will do whatever it takes to secure Britain's borders.""A Plaid Cymru spokesperson said illegal workers and those who employ them should be held to account by the law, ""but performative measures and photo-ops are no remedy for chronic mismanagement at the Home Office"".It said the Home Office needed to ""overhaul the entire asylum processing system and ensure safe and managed migration routes for people who qualify to come to the UK.""Shadow Welsh secretary Mims Davies said the figure was a ""drop in the ocean"" compared to the 36,000 people who Labour had allowed to illegally enter the country in 2025.""It is only the Conservative Party that have a serious, hard-edged plan to deliver stronger borders,"" she said.Reform UK's Wales spokesman said: ""These figures paint a bleak picture of the old parties' records on immigration and illegal working.""Successive Labour and Conservative governments have allowed the underground economy to thrive by failing to control our borders and crack down on these practices.""Related topicsWalesUK immigrationHome Office"
