url,title,year,text,sector,nationality
https://www.bbc.co.uk/news/uk-england-london-31001660,"Women 'find it harder to work' in London, says GLA report",2015,"gla economics found 60% of women with children, who are eligible to work, have a job in london

women are finding it harder to work in london than the rest of the country because of the costs of transport and childcare, according to a report.

cuts in benefits and tax credits since the financial crisis are further reasonscited by the gla (greater london authority) economics study.,external

it finds 60% of women with children, who are eligible to work, have a job in london.

that compares with just under 70% across the country, the report says.

the mayor of london's office said it was ""working to increase the number of flexible and good quality paid jobs for women"".

since 2008, part-time jobs in the capital have increased by nearly a quarter - to 1.6 million - compared to a 9% increase in the uk.

however, women are not getting the same access to work as elsewhere, thepart-time employment in london report,externalsaid.

it said the costs of transport and childcare are barriers to women returning to work, with childcare costs in london 28% higher than the british average, according to the daycare trust.

childcare costs in london are 28% higher than the british average according to the daycare trust.

because 34% of people use public transport in london, both the time it takes to travel and the price of fares reduce the incentive to get part-time work, gla economics said.

""the costs of travelling to work are likely to be higher in london than elsewhere in the uk,"" it says.

""the choice of whether to work part-time needs to factor in higher opportunity costs for working as compared  to those working full-time.

""longer journey times mean subtracting time from other important activities such as childcare, and because this is more expensive in london, it may well not pay for some to take a part-time job.""

but another major factor is that the tax and benefit system does not compensate for london's higher cost of living, according to the report.

it says the coalition government's abolition of the in work credit allowance removed one way of giving eligible londoners a premium to offset higher living costs.

""other changes to the welfare system, affecting couples with children in particular, have occurred and are likely to continue to occur in the future (e.g. universal credit).

""if these policy changes do not take into account london's circumstances, the relative disincentive to take work in london (as compared to the rest of the country) could remain or become higher still.""

karen buck, labour mp for westminster north, said the high cost of living in the capital had been exacerbated by low pay.

recent research by the trades union congress (tuc) suggested in six boroughs -  bexley, newham, merton, harrow, redbridge and waltham forest - the majority of female part-time workers earn less than the london living wage of â£8.80 an hour.

""london needs a better deal on childcare, improvements in the minimum wage and faster progress towards the living wage,"" ms buck said.

a mayor of london spokesman said: ""the mayor is looking at ways to work with employers to improve and increase the number of flexible and good quality paid jobs for women, particularly those with childcare responsibilities.

""he has introduced a part-time travelcard with transport for london and plans to commission employment programmes focused on supporting parents who are out of work or in low paid work to access good quality sustainable jobs.""",not mentioned,british
https://www.bbc.co.uk/news/av/health-51660561,Coronavirus: How a 'drive-through' testing facility in London works,2020,"the nhs has launched a new scheme to test people for coronavirus, which can cause the respiratory disease covid-19.

the bbc's health editor, hugh pym, was shown a demonstration of how a ""drive-through"" testing facility purpose-built at central london community healthcare nhs trust will work.

this sort of safe and convenient testing scheme is being rolled out across the country at nhs sites.

more than 7,000 people in the uk have been tested for the virus, with 15 people testing positive so far.",not mentioned,not mentioned
https://www.bbc.co.uk/news/articles/ce8vggkgzr2o,Delivery riders getting illegal e-bikes seized,2024,"most of the riders who had illegally modified e-bikes seized in the city of london in the past year were food deliverers trying to get a faster vehicle to do their job, the head of a specialist unit seizing the bikes has said.

new figures released by 27 police forces to the pa news agency show a steep increase in the number of seizures of e-bikes which have been illegally modified to go faster than 15.5mph - the speed at which they are required to cut out under uk law.

speaking to the bbc, city of london police's sgt stuart ford, who leads the cycle response unit, explained the vehicles did not need to be insured and the ""vast majority"" of the ones his force seized were used by deliverers.

in response to the bbc, food delivery service deliveroo said it would not work with any riders caught using illegally modified e-bikes.

the broad term 'e-bike' is commonly used for any electric-powered bike, but it can actually refer to very different types of equipment which are covered by different laws.

e-bikes: what is the law and is there an age limit?

bikes which have a small electrical motor which helps cyclists to move the pedals have the 15.5mph (25 kph) speed limit, and their motors cannot exceed 250 watts of power.

these are electrically assisted pedal cycles (eapc), and under the law these are treated the same as a bicycle and therefore riders do not have to seek insurance.

illegal e-bikes are more powerful and reach higher speeds, and are not necessarily illegal in themselves - but under the law they are classified as motorcycles, and should not be driven without a licence on the roads.

modification kits, some of which are sold for as little as â£300, can also be used on regular bicycles and allow them to potentially reach speeds as fast as 60mph.

across the uk, figures show 937 illegal e-bikes were seized in the year to 11 august - up from 511 in the previous 12 months, an 83% increase.

the pa news agency received responses to freedom of information requests from 27 out of 46 police forces it contacted.

among the forces with the largest year-on-year increases in e-bike seizures were wiltshire police (from 24 to 64), police scotland (from 60 to 233), derbyshire police (from four to 23), northumbria police (from 18 to 58) and south wales police (from 66 to 137).

city of london police recorded 295 seizures, which was more than any other police force that provided figures - although it did not have a comparable number for the year before.

speaking to bbc radio 4's today programme, sgt ford was asked if most of the e-bikes being seized were used by delivery riders.

he said this was true in ""the vast majority of cases"".

""especially... ones which are are being adapted,"" he said.

""so theyâll buy a normal bike, and then theyâll buy a kit online of batteries - which are unstable in a lot of cases - throttles and rear hub motors that will turn them into mopeds basically.""

the police force, which is responsible for policing the square mile in central london, set up its cycle response unit in july last yearin response to community concerns about road safety and anti-social behaviour,external.

earlier this year, city of london ch supt rob atkin,externalsaid: ""some people have told us that they have nearly been hit and have seen riders mount pavements and run through red lights.""

a spokesperson for deliveroo said it takes its ""responsibilities seriously to ensure the safety of riders and the communities where we operate"".

""riders are required to use legal and roadworthy vehicles at all times, and as with all road users, they must follow local traffic laws and regulations.""

efforts have been made to tighten up the rules for cyclists generally, and specifically for anyone using illegal e-bikes.

prior to the conclusion of the last parliament, legislation spearheaded by tory mp iain duncan smith wouldhave made dangerous cycling a specific offence.

the law change, which would have come in as part of an amendment to the criminal justice bill, was not passed in time for the end of the last parliament.

speaking on bbc radio 4's today programme, duncan smith said he would continue to campaign for a change in the law.

""itâs getting [cyclists] within the highway code, so that dangerous cycling, or cycling that causes death or injury, are prosecutable offences. and for cyclists to understand theyâre not above the law,"" he said.",delivery,not mentioned
https://www.bbc.co.uk/news/uk-england-london-23970573,Â£1m illegal porn haul made in south London,2013,"more than 100,000 unclassified dvds and magazines were seized

more than 100,000 items of illegal pornography bound for newsagents have been seized in south london.

the unclassified dvds and magazines worth an estimated â£1m were due to be sold in westminster newsagents, said westminster city council.

inspectors also found dvds rated restricted 18, which can only be supplied to licensed sex shops.

there were four raids on two suppliers operating out of merton and wandsworth.

councillor nickie aiken of westminster city council said he feared corner shops were the ""new frontier"" for the illegal porn industry.

the dvds found during the raids matched those found by council officers on recent visits to 17 newsagents in westminster.",not mentioned,not mentioned
https://www.bbc.co.uk/news/articles/czjyn0d2ngro,The Night Stars helping revellers get home safe,2024,"emmanuella fadire is on hand when revellers become vulnerable on a night out

as crime increases in central london's popular nightlife hotspots, according to a council report, a group of volunteers are working to keep revellers safe.

westminster city council reported an 11% increase in sexual offences in the borough - 84% of those victims were women.

the authority's night stars provide an all-round service to those who could become vulnerable on a night out, armed with vomit bags, alarms, drink spiking test kits, plastic drink covers and flip-flops.

âitâs really rewarding,â said volunteer emmanuella fadire. âyou help a lot of people and make them feel safe. you also have a nice time out and get a lot of people thanking you.â

as the councilâs womenâs safety and hate crime officer, ms fadire leads the stars on most shifts.

at the start of a night shift, she hands out walkie-talkies and leads the volunteers out of their hub at st anneâs church on dean street.

ms fadire says she has helped many people in her six years as a volunteer then employee - from consoling those who have had their belongings stolen to protecting women from being followed by men they do not know.

âeveryone deserves a fun night out,â she said.

the night stars engage with as many as 20 people a night

the night stars began patrolling london's partying hotspots in march 2022 to assist anyone who becomes vulnerable due to intoxication get home safely.

they hand out water and sweets to help people sober up. ms fadire said flip-flops were often the most popular item in stock.

âwe give them to people who have maybe lost their shoes or are just walking around barefoot,"" she said.

âa lot of people are either happy or confused by them.â

volunteers could engage with as many as 20 people a night, ms fadire said.

rebecca damm, 45, who started volunteering six months ago, said: âafter midnight, it gets different - it feels a bit darker, the energy.

âit feels a little more chaotic and when it gets chaotic, you feel people can become more vulnerable and then you get more people, perhaps, approaching vulnerable people.â

ms damm said: âwe see a lot of young women come out of bars and lurkers start to walk over and befriend them. i havenât seen a group of girls not handle themselves but you can see the lurkers waiting for that kick out.""

rebecca damm, left, and emmanuella fadire often tour soho as night stars

daniel khalid, 24, has been volunteering for five years and said he would see the same men loitering around.

greek street had been a particular trouble spot but things were ""getting betterâ, he said.

given the tourist hotspots they work in, the night stars often help holidaymakers.

on one occasion, the team helped a family visiting from denmark find accommodation after an issue with their booking.

ms damm said: âthey came back and gave us a card and sweets as a thank you. they also made a donation.â

westminster city council's annual survey found a third of women in the borough had had a personal experience of street harassment, and 45% reported feeling unsafe at night.

crime has also doubled in two years to on average 216 incidents a day and is costing the council â£371m, according to an analysis of crime figures.

the majority of these (60%) were theft offences with many happening in the west end or st jamesâs at night.

the same research found westminster city recorded more than 90,000 criminal offences, more than double the next highest borough.

in response, businesses are being trained in stamping out sexual harassment in their venues.

councillor iman less says the scheme provides women with more security on nights out

labour councillor iman less, the council's nightlife champion, said: âour main priority is to make sure you get home. we have a different role to the police. we have a different role to the ambulance. we have a different role to security or bar staff.â

ms less said the night stars could provide women with an ""added sense of security"".

estella adeyeri from the good night out campaign, said the night stars provided a ""vital service the police cannot"".

she said in a climate where ""trust in policing is so low, providing an avenue for people to seek help without incriminating themselves is important"".

the 34-year-old communications coordinator said: âif someoneâs over-intoxicated, maybe because theyâve consumed an illegal substance, theyâre still vulnerable.

""they might not want to approach someone who is going to criminalise that activity rather than looking at their vulnerability, looking at them without any judgement and saying, âyou know, that person just needs helpâ.""

to ms fadire, there is no silver bullet to making a night-out safer.

instead, she suggests rethinking how we licence venues selling cheap drinks and wants establishments to do more to help patrons sober up before leaving.

the met police has been contacted for comment.

listen to the best of bbc radio london onsoundsand follow bbc london onfacebook,external,x,externalandinstagram,external. send your story ideas tohello.bbclondon@bbc.co.uk,external",security,not mentioned
https://www.bbc.co.uk/news/uk-england-london-66393677,"London Silvertown tunnel works are now complete, says TfL",2023,"a photos of the completed tunnelling works was taken from the ics cloud cable car by siã¢n berry, a green member of the london assembly

the boring beneath the thames to form the silvertown tunnel has been completed, transport for london (tfl) says,

due to open in 2025, the 1.4km river crossing will link silvertown, in newham, with the greenwich peninsula.

the project has received criticism, with opponents arguing it will increase emissions in the area.

tfl says the scheme will address issues with the blackwall tunnel and reduce pollution.

the blackwall tunnel is the only major crossing of the thames in east london and often suffers from closures and heavy traffic.

the silvertown tunnel will be the city's first road tunnel in over three decades.

tunnelling starts for new london river crossing

silvertown tunnel: cracks in mayoral policies

silvertown tunnel: london mayor sadiq khan defends project

helen wright, head of the silvertown tunnel programme at tfl, has said the project will ""support growth in the local area, provide new public transport connections across the river via zero-emission bus routes and address the chronic issues londoners face at the blackwall tunnel"".

however, siã¢n berry, a green member of the london assembly, believes the scheme will increase car dependency and cause pollution.

she previously authored a report proposing alternative uses for the tunnel, such as for a tram system or as an extension to the docklands light railway (dlr).

this week, she called on mayor sadiq khan to ""make this real blot on his record turn into something more positive"".

in september, mr khan defended the silvertown tunnel on bbc radio london, saying the east of london had been ""neglected for centuries"".

follow bbc london onfacebook,external,twitter,externalandinstagram,external. send your story ideas to hellobbclondon@bbc.co.uk",not mentioned,not mentioned
https://www.bbc.co.uk/news/uk-england-london-44793707,"London grammar school's exclusion policy was illegal, report finds",2018,"the inquiry into st olave's school in south-east london exposed scenes of distressed pupils after being excluded midway through sixth form

a grammar school that forced out pupils unlikely to achieve high grades in their a-levels acted illegally, an independent inquiry has found.

the policy at st olave's school in london from 2010 to 2017 meant pupils were treated as ""collateral damage"", thebromley council report,externalsaid.

excluding pupils ""based on academic ability"" breaches the education act.

the headmaster who oversaw the policy said he did not know it was illegal. the school fully accepts the findings.

christine whatford cbe, who conducted the inquiry, said pupils were threatened with exclusion despite suffering depression, anxiety or trauma.

one member of staff said a student was so fearful of telling his parents about his exclusion ""that he might as well kill himself"", while others described scenes of ""distraught pupils crying in the car park"".

former headmaster aydin ãnaã§ should have known the policy was illegal

headmaster aydin ãnaã§who resigned from the orpington school at the end of 2017, told the inquiry that ""no one ever told him [the policy] was illegal and that many other schools do it"".

but it was his responsibility to know, ms whatford wrote, addinggovernment guidance,externalsent to schools stated it was not permitted.

she also said the illegality of it should have been ""picked up"" by bromley council, which said it fully accepts the report it had commissioned.

the department for education said it wrote to all secondary schools in september 2017 reminding them that ""it is illegal for schools to exclude pupils based on academic ability"", which is contrary toregulations set out under the education act.,external

in 2017 the school had asked parents for voluntary monthly contributions from â£50 to â£60 to help the school survive because it was in ""dire straits financially"" but it had built up ""nearly â£2m in unrestricted reserves""

staff were intimidated by mr ãnaã§ and the school's culture did not encourage open and honest consultation and discussion

only two out of 100 existing staff members expressed support for mr ãnaã§ and of the rest, the majority were ""too scared"" to contribute to the inquiry until after he had resigned

every governor ""prepared to challenge"" mr ãnaã§ and some of his policies ""were removed"" by a reconstitution of the school's governing body in 2015

mr ãnaã§ denied that he had orchestrated the reconstitution to bring this about

ms whatford urged the school to apologise to parents and pupils affected by the exclusion policy.

the school said ina statement,externalit has worked with parents, carers, staff and students to make key improvements.

""we know there is still work to be done and so we will continue to work with you, the borough and the diocese of rochester as we seek to address any remaining actions.""

ms whatford also asked the people behind st olave's unofficial news, a website ""highly critical"" of mr ãnaã§, to close down the site for it ""will remain a symbol of the divisions and tensions"".

but a spokesperson for the site said its visitors want it to stay online ""as a historical record of how an 'outstanding school' can be failing its staff and students"".

mr ãnaã§ has been contacted for comment.",not mentioned,not mentioned
https://www.bbc.co.uk/news/uk-england-london-56416279,NHS worker left with serious facial injuries after London Tube attack,2021,"british transport police want to speak to this man in relation to the attack

an nhs worker who was attacked after confronting a maskless man on the london underground had to have metal plates put into his face.

the victim suffered a chipped jaw and three eye socket fractures after being repeatedly punched and then pushed onto the platform from the train.

the attack happened on the 3 october last year at 22:00.

british transport police have released an image of a man they want to speak to in relation to the attack.

he is described as white, in his 20s, with blonde hair, clean shaven and wearing a navy blue suit with light blue shirt. he was also carrying a green umbrella.

the victim approached a group of three maskless people, including his attacker, as he was preparing to get off the train at high street kensington and an argument broke out.

the group of two men and one woman continued on the circle line following the altercation.

police would like anyone with information, or who witnessed the attack, to come forward.

wearing masks was made compulsory on public transport on 15 june 2020.

fines or not wearing one start at â£200 and increase for repeat offences up to a maximum of â£6,400.",not mentioned,british
https://www.bbc.co.uk/news/articles/cz9qqrpyr6po,Fundraiser for four-year-old rail fan with cancer,2023,"rail fan teddy lichten, 4, has childhood cancer neuroblastoma

the mother of a young rail fan with cancer has thanked workmates who are visiting 500 train stations to raise funds for the boy.

four-year-old teddy lichten, from hassocks in west sussex, was diagnosed with high-risk neuroblastoma in july 2022.

the family areaiming to raise â£300,000for treatment offered in the us which is unavailable in the uk.

work colleagues of kat lichten are visiting every london tube and railway station to help raise â£1,500.

ms lichten, 34, said she was ""so touched"" they had taken on the challenge.

she said: ""i'm very thankful for their support, especially as i have been unable to return to work since teddy's diagnosis as he has been so unwell.""

she said her son ""loves to watch the videos they share of the stations they have visited for him"".

when teddy was diagnosed, the cancer had already metastasized in nearly every area of his body and had taken over 60% of his bone marrow.

teddy has already undergone several rounds of chemotherapy and other treatments

florian frank fleitmann, 40, who organised the train station fundraiser, said: ""teddy obviously is a big fan of trains and everything to do with trains, and we were thinking, what can we do to support katherine and teddy and their family.""

the colleagues at marketing firm w&j linney have visited 50 station so far.

they have been documenting their progress with photos and videos, which they plan to collate for teddy.

the family have raised more than â£150,000 so far for teddy's treatment.

follow bbc south east onfacebook,external, ontwitter,external, and oninstagram,external. send your story ideas tosoutheasttoday@bbc.co.uk,external.",not mentioned,not mentioned
https://www.bbc.co.uk/news/uk-england-london-14724801,Half of London shopkeepers aware of illegal tobacco sales,2011,"half of london's corner shopkeepers are aware of smuggled and counterfeit tobacco being sold in their area

half of london's corner shopkeepers are aware of smuggled and counterfeit tobacco being sold in their area, a survey has found.

the tobacco retailers alliance asked 1,062 uk retailers their knowledge of the sale of smuggled and counterfeit tobacco and its supply to under 18s.

the survey also revealed that 54% of london respondents were aware of adults legally buying tobacco for under 18s.

some 15% of retailers were aware of smugglers supplying teenage smokers.

shopkeeper debbie corris, the south east spokeswoman for the tobacco retailers alliance, said it was ""shocking"" that so many smugglers were supplying the underage with tobacco.

the alliance estimates that the black market in smuggled and counterfeit tobacco already causes a loss to the treasury of â£8.2m each day and deprives legitimate businesses of trade.

""in this economic climate, it's understandable there's a temptation to buy tobacco from smugglers who charge half what i charge,"" added ms corris.

""smokers need to know that if it sounds too good to be true, it probably is. if you buy from smugglers, you don't know what you're going to get.""",not mentioned,not mentioned
https://www.bbc.co.uk/news/av/uk-59065876,Undercover filming of illegal gases being sold in London,2021,"a bbc investigation has uncovered a black market in highly polluting greenhouse gases, which are being smuggled into the uk from eastern europe.

the gases - called hydrofluorocarbons (hfcs) - are being illegally advertised on and sold via social media.

the bbc found them openly advertised for sale on social media across the uk and tracked them down, being sold from a home in london.",not mentioned,not mentioned
