URL,Title,Date,Text
https://www.bbc.co.uk/news/articles/c5y5379djl3o,Starmer considering digital ID scheme to tackle illegal migration,2025-09-04T14:59:42.292Z,"Starmer considering digital ID scheme to tackle illegal migrationTo play this video you need to enable JavaScript in your browser.This video can not be playedMedia caption,Starmer considering digital ID cards to tackle illegal immigrationByPaul SeddonPolitical reporterPublished4 September 20254126 CommentsSir Keir Starmer has confirmed for the first time the government is looking at digital ID as a way to tackle illegal immigration.The prime minister said a new identity programme could play an ""important part"" in reducing the incentive to enter the UK without permission.He added things had ""moved on"" since the fraught debate over ID cards under the last Labour government in the mid-2000s.But Conservative leader Kemi Badenoch said: ""I think as a way of helping to control immigration, it is not really going to solve the problem.""Labour MPs call for digital IDs to tackle migrationPublished8 AprilSpeaking to political editor Chris Mason, Sir Keir said: ""We all carry a lot more digital ID now than we did 20 years ago, and I think that psychologically, it plays a different part.""Asked whether a new scheme could play a role in reducing the attractiveness of the UK as a destination for illegal migrants, he added: ""My instinct is it can play an important part. Obviously we need to look through some of the detail.""He added that, two decades on from the row over New Labour's physical ID card scheme, the public was likely to ""look differently"" at a digital-based scheme.He did not confirm whether any new digital ID scheme would be mandatory.By law, employers have to check that prospective candidates have the right to work in the UK.Since 2022, they have been able to carry out checks on passport-holding British and Irish citizens by using digital verification services that have been certified by the government.A Home Office online scheme also exists to verify the status of some non-British or Irish citizens, whose immigration status is held electronically.It is understood officials are looking at whether requiring a digital ID could provide a more consistent approach to verifying identity.They are also thought to be exploring whether the scheme could reduce the use of fake documents, and make it easier to target enforcement activity.Estonia visitSir Keir's comments are the most positive remarks yet by the prime minister about the idea, which is likely to reignite a debate over civil liberties.Cabinet Office minister Pat McFadden has visited Estonia recently to examine the Baltic state's extensive use of digital identity to allow citizens to access government and some private services such as medical records, voting and banking.The government haspreviously rejecteda digital ID proposal suggested by former Labour Prime Minister Sir Tony Blair, whose government introduced plastic ID cards in the late 2000s.Legislation to introduce the scheme was the subject of bitter clashes in the House of Lords, and plans to make them compulsory for UK citizens was later dropped.Around 15,000 entered circulation but the scheme was scrapped, and database destroyed, by the Conservative-Liberal Democrat coalition government in 2011.Asked for the Tory position on digital ID, leader Kemi Badenoch said it would not help the government fulfil its pledge ""smash the gangs or stop the boats"".""A lot of people who come to the country end up disappearing into the grey economy, or the black economy. and working illegally,"" she added.""Digital ID cards would not fix that.""Checks extendedThere are sanctions including fines of up to Â£60,000 per unauthorised worker in cases where foreign workers are found to be working illegally.For agency workers, the responsibility lies with the agency to conduct the relevant checks.In March, the government announced the requirement to conduct a testwould be extendedto self-employed contractors carrying out work on behalf of a company.Currently, firms are responsible for conducting checks on such workers only if they have sponsored the visa allowing them to work in the UK.Home Secretary Yvette Cooper argued the extension would help enforcement in the so-called gig economy, where many workers are employed in temporary or casual roles.In July, French President Emmanuel Macron said the UK had agreed to address the ""fight against illegal work"" as part of pull factors attracting illegal migrants.The government has also been under pressure to find alternative living arrangements for around 32,000 asylum seekers currently living in taxpayer-funded hotels whilst their claims are processed.Ministers have promised to stop using hotels to house asylum seekers by the time of the next election, due by 2029.Sir Keir said he had asked officials at the Home Office and Ministry of Defence to ""work at pace"" to identify military sites that could be used to provide alternative accommodation.Sign up for our Politics Essential newsletterto keep up with the inner workings of Westminster and beyond.Related topicsKeir Starmer"
https://www.bbc.co.uk/news/articles/cy404wyemd9o,Fifteen illegal workers arrested at solar farm,2025-09-03T18:42:45.097Z,"Fifteen illegal workers arrested at solar farmImage source,Getty ImagesImage caption,The government has returned more than 35,000 people with no right to be in the UK since July 2024ByBea SwallowBBC News, BristolPublished3 September 2025Four illegal construction workers have been detained pending their removal from the UK.Supported by Avon and Somerset Police, the Home Office's Immigration Enforcement team arrested 15 illegal workers at the Goldbeck Solar Farm in Bristol.The remaining 11 people have been placed on immigration bail with strict reporting conditions, and their employer could face a fine of up to Â£45,000 per illegal worker. Goldbeck Solar Farm said it had launched an urgent investigation into the incident.The operation forms part of the government's zero tolerance approach to illegal working under its Plan for Change and follows a 50% surge in visits and arrests since July 2024.More news stories for BristolWatch the latest Points WestAttributioniPlayerListen to the latest news for BristolAttributionSoundsThose arrested were of Kazakhstani, Turkish, Georgian, Uzbekistani, Kyrgyz and Tajikistani nationalities, and 13 had entered the UK on temporary work visas.All 13 submitted asylum claims prior to their visas expiring. Of these, 10 claims remain outstanding and three claims have been refused.One individual had entered the UK on a standard visitor visa and claimed asylum - which is still outstanding.Another individual entered the country on a Turkish ECAA business visa but was arrested for working in breach of his conditions.The liable employer could face a substantial fine if found to have employed illegal workers and failed to conduct relevant pre-employment checks.Penalties include a fine of up to Â£45,000 per illegal worker for a first breach, and up to a maximum of Â£60,000 for repeat offending.'Tough approach'Dame Angela Eagle, minister for border security, immigration and asylum, said illegal working ""will no longer be tolerated"" under the Plan for Change.""We are taking a tough approach to tackling illegal working right across the UK and this operation is just another example of our relentless focus to disrupt immigration offenders.""From our city centres to rural farmland, there should be no hiding place from the law.""That's why we have increased arrests, sanctioned rogue employers, and continue to safeguard those exploited from this criminality.""The government has returned more than 35,000 people with no right to be in the UK since July 2024, including failed asylum seekers, immigration and foreign national offenders.Goldbeck Solar Farm said: ""We are taking this seriously and have launched an urgent investigation.""Get in touchTell us which stories we should cover in BristolContact formContact formFollow BBC Bristol onFacebook,external,X,externalandInstagram,external. Send your story ideas to us on email or viaWhatsApp on 0800 313 4630.Related topicsUK VisasUK immigrationHome OfficeImmigrationBristolMore stories like thisIndian restaurant shut after illegal workers foundPublished25 April'Illegal delivery drivers' held in caravan raidPublished9 October 2024Caravan raid sparks calls for citizenship changePublished17 October 2024Related Internet LinksHome Office - UK Visas and Immigration"
https://www.bbc.co.uk/news/articles/cy8j6dz2428o,Bar that had illegal workers withdraws licence bid,2025-08-31T13:28:48.464Z,"Bar that had illegal workers withdraws licence bidImage source,GoogleImage caption,The previous licence for the restaurant in Stanfield Road, Bournemouth, was revoked in MayPublished31 August 2025A takeaway restaurant where illegal workers were found has withdrawn its bid for an alcohol licence.The previous licence for Chicken n Beer in Stanfield Road, Bournemouth, was revoked in May after immigration officialssaw a man and a woman run out of it in February.Cloud Brands Ltdapplied for a new licencebut Dorset Police said it had ""significant concerns"" about the relationship between its owner and the man previously responsible for the bar.Bournemouth, Christchurch and Poole Council licencing committee, which had been due to determine the application, said it had now been withdrawn by the applicant.Get in touchDo you have a story BBC Dorset should cover?Contact formContact formYou can followBBC DorsetonFacebook,external,X (Twitter),external, orInstagram,external.Related topicsHome OfficeDorsetBournemouthBournemouth, Christchurch and Poole CouncilBeerMore on this storyLicence bid for bar that had illegal workers delayedPublished29 JulyAlcohol licence bid for bar that had illegal workersPublished23 JulyBar where illegal workers found stripped of licencePublished28 MayChicken bar with illegal workers could lose licencePublished20 MayRelated internet linksBCP Council"
https://www.bbc.co.uk/news/articles/cy85zrlp81mo,Licence bid pulled at bar that had illegal workers,2025-08-28T09:35:47.637Z,"Licence bid pulled at bar that had illegal workersImage source,Getty ImagesImage caption,The application was due to be heard on WednesdayPublished28 August 2025A company has pulled a plan to sell alcohol at a chicken bar where illegal workers were found.The permission for Chicken N Beer in Stanfield Road, Bournemouth,was revoked in Mayafter immigration officials saw a man and a woman run out of it in February.Another company, Clouds Brands Ltd, applied for a new licence but Dorset Police said it had ""significant concerns"" about the relationship between its owner and the man previously responsible for the bar.The application had been due to be discussed at BCP Council's licensing sub-committee on Wednesday but chairman David Flagg said it had been withdrawn. It had beenadjourned until then last month.Get in touchDo you have a story BBC Dorset should cover?Contact formContact formYou can followBBC DorsetonFacebook,external,X,external, orInstagram,external.Related topicsDorsetBournemouthMore on this storyLicence bid for bar that had illegal workers delayedPublished29 JulyAlcohol licence bid for bar that had illegal workersPublished23 JulyBar where illegal workers found stripped of licencePublished28 MayChicken bar with illegal workers could lose licencePublished20 MayRelated internet linksBCP Council"
https://www.bbc.co.uk/news/articles/cewyj8y0dzjo,Restaurant loses licence after illegal worker fine,2025-08-16T16:58:34.525Z,"Restaurant loses licence after illegal worker fineImage source,Getty ImagesImage caption,The Home Office had called for The White Horse's council-issued licence to be revokedByCarmelo GarciaLocal Democracy Reporting ServicePublished16 August 2025A Chinese restaurant previously fined Â£135,000 for employing three illegal workers has now been banned from selling alcohol.The White Horse in Longford, near Gloucester, was visited by Home Office inspectors in August last year. They found three workers from Indonesia who had no right to work in the UK.The Home Office handed the Â£135,000 civil penalty to the owner's company R&R (Gloucester) and called for the restaurant's council-issued licence to be revoked.Ahead of a licence review hearing on Thursday held by Tewkesbury Borough Council, owner Lee Yap Kheang said the business would ""without doubt"" have to close if it could not sell alcohol.Image source,GoogleImage caption,The White Horse was found to be employing three illegal workers from IndonesiaMr Kheang told councillors the restaurant now employed five workers from the local community, adding: ""We cannot survive without the profit revenue from alcohol sales as the economic climate for restaurants is so tough now.""He said he had worked very hard to build a village restaurant against all odds â including repeated floods.""People rely upon me and the village is my home and its residents, my deeply valued friends,"" he said.According to theLocal Democracy Reporting Service, the council's licensing sub-committee nevertheless voted to revoke the restaurant's licence.""We hope this decision makes it clear that serious breaches won't be ignored,"" a council spokesperson said.'No pay'Home Office inspectors had initially visited the restaurant after being told in a tip-off that Mr Kheang had been employing illegal workers for no pay, in return for food and accommodation at the restaurant.He told the inspector the workers helped out only occasionally with minor tasks such as washing dishes and tidying the garden.""When questioned about right to work checks, Kheang admitted to seeing the letters about claiming asylum but did not conduct any checks,"" a Home Office report stated.""He further admits, 'I know they are not allowed to work.'""Mr Kheang now has a right to appeal regarding the restaurant's licence.Get in touchTell us which stories we should cover in GloucestershireContact formContact formFollow BBC Gloucestershire onFacebook,external,X,externalandInstagram,external. Send your story ideas to us on email or viaWhatsApp on 0800 313 4630.Related topicsUK immigrationHome OfficeLongfordGloucesterGloucestershireRelated internet linksTewkesbury Borough CouncilLocal Democracy Reporting ServiceMore stories like thisRestaurant loses licence after Home Office raidPublished13 October 2023Store under review after selling alcohol to minorsPublished31 August 2024"
https://www.bbc.co.uk/news/articles/cr5r6dz1yj8o,Restaurant with illegal workers loses alcohol licence,2025-08-01T05:32:47.516Z,"Restaurant with illegal workers loses alcohol licenceImage source,GoogleImage caption,The business was fined Â£90,000 for employing two people who did not have the right to work in the UKByElena ChiujdeaLocal Democracy Reporting ServicePublished1 August 2025A restaurant fined Â£90,000 for employing illegal workers has had its alcohol licence revoked.Immigration officers found the three workers at Exotic Karahi in Farnham Road, Slough, during a visit in September 2024.They were identified as immigration offenders and reported receiving free food in exchange for their labour during an interview.A Slough Borough Council meeting heard this could have amounted to ""modern-day slavery"".Exotic Sweet Centre Limited, which trades as Exotic Karahi, received the civil penalty for employing two people who did not have the right to work in the UK in November.The Home Office then requested a review of the business's premises licence in June, on the grounds its ""prevention of crime and disorder"" conditions had not been met - a view supported by Thames Valley Police, councillors heard.The Home Office said the licence holder and management had ""failed to conduct mandatory employment checks to prevent illegal working"".Caroline Laird, a Home Office immigration enforcement officer, said: ""[The workers] were paid by way of food, which, obviously is also a way of going unnoticed and promoting working for nothing really, as they don't have any other means of gaining lawful employment in the UK.""Sub-chair of the committee, councillor Mohammed Nazir, asked: ""In other words, they could have been constituted as slave labour?""Ms Laird replied: ""Yes, modern-day slavery.""'Learned lessons'Restaurant owner, Inderpaul Roa, told councillors he was diagnosed with Guillain-BarrÃ© syndrome (GBS) and recovering at the time of the raid.He said: ""I was literally paralysed and so I was in hospital. This sort of happened over night.""He said a manager was hired during this time, and oversaw hiring workers and overseeing their immigration status. The manager was fired following the case.Surendra Panchal, the legal representative of Mr Rao and his son Deep Singh Rao, said: ""We are not running away from the mistake that was caused at the premises.""We have explained to you why those mistakes were happening, and we've learned a lesson from it.""The restaurant will still be able to sell food and soft drinks until 23:00 BST.Get in touchDo you have a story BBC Berkshire should cover?Contact formContact formYou can followBBC BerkshireonFacebook,external,X (Twitter),external, orInstagram,external.Related topicsBerkshireUK immigrationSloughSlough Borough CouncilMore on this storyRestaurant could lose licence over illegal workersPublished22 JulyRelated LinksSlough Borough Council"
https://www.bbc.co.uk/news/articles/ckgjd9933k9o,Licence bid for bar that had illegal workers delayed,2025-07-29T11:58:32.522Z,"Licence bid for bar that had illegal workers delayedImage source,Getty ImagesImage caption,The hearing will now be heard next monthPublished29 July 2025A decision on whether a company should be able to sell alcohol at a chicken bar where illegal workers were found has been delayed.The permission for Chicken N Beer in Stanfield Road, Bournemouth, was revoked in May after immigration officialssaw a man and a woman run out of it in February.Cloud Brands Ltdhas applied for a new licencebut Dorset Police said it had ""significant concerns"" about the relationship between its owner and the man previously responsible for the bar.The application was expected to be decided by Bournemouth, Christchurch and Poole (BCP) Council's licensing sub-committee earlier but that was adjourned until 27 August so all parties could be represented.Get in touchDo you have a story BBC Dorset should cover?Contact formContact formYou can followBBC DorsetonFacebook,external,X (Twitter),external, orInstagram,external.Related topicsHome OfficeDorsetBournemouthBournemouth, Christchurch and Poole CouncilBeerMore on this storyAlcohol licence bid for bar that had illegal workersPublished23 JulyBar where illegal workers found stripped of licencePublished28 MayChicken bar with illegal workers could lose licencePublished20 MayRelated internet linksBCP Council"
https://www.bbc.co.uk/news/articles/clyxkd3neveo,Takeaway licence revoked over illegal workers,2025-07-23T12:37:22.025Z,"Takeaway licence revoked over illegal workersImage source,GoogleImage caption,The council's licensing committee voted unanimously to revoke the venue's licenceByBill EdgarLocal Democracy Reporting ServicePublished23 July 2025A takeaway has had its alcohol licence suspended after illegal workers were found there during several immigration raids.New Red Lantern in Chester-le-Street, County Durham, was accused of assaulting and obstructing Home Office workers and not registering staff, despite repeated warnings.A Durham County Council licensing hearing was told staff also refused to cooperate with officers' investigations and shouted warnings to workers to evade detection.Chris Woodrow, representing licence holder Song Min He, said he had proposed making several improvements, including taking a licence qualification.But the Home Office warned the alcohol licence, for between 23:00 and 02:00, should be revoked due to the repeated incidents.Lee Harkus, from Immigration Enforcement, said: ""This premises has been repeatedly found using illegal workers.""The first visit should have served as an opportunity to improve the business practices, however, this was not the case.""'Proactive obstruction'Immigration officers raided the premises on Front Street three times between 2019 and 2025 and found 10 people working there illegally.Licence holder Song Min He said he rented the ownership of the takeaway to another company in 2022 due to illness, and did not have oversight of the business.Dhax Limited, the company previously listed as in control, had already been fined Â£28,000 for employing workers illegally, with another potential penalty under consideration, the hearing heard.Mr Woodrow said the licensee accepted Dhax had not ""done it properly, but he has got somebody else in now"".However, the council's licensing committee voted unanimously to revoke the venue's licence, theLocal Democracy Reporting Servicesaid.Mr Harkus added: ""The repetitive proactive obstruction and more recent assault of a law enforcement officer is a clear demonstration that the responsible management of the premises is not a high priority to the licence holder.""He was not only present during the visit conducted in 2019, but he was complicit in obstructing officers entering the kitchen area and was witnessed shouting instructions to others to block officers, which resulted in him being forcibly removed.""Follow BBC North East onX,external,Facebook,external,NextdoorandInstagram,external.Get in touchDo you have a story suggestion for BBC Wear?Contact formContact formRelated topicsUK immigrationChester-le-StreetRelated internet linksDurham County Council"
https://www.bbc.co.uk/news/articles/c625p0g23vzo,Alcohol licence bid for bar that had illegal workers,2025-07-23T09:49:33.077Z,"Alcohol licence bid for bar that had illegal workersImage source,Getty ImagesImage caption,The application for Chicken N Beer will be decided at a meeting next TuesdayByNathan BriantBBC NewsPublished23 July 2025A company has applied to sell alcohol at a chicken bar that had a licence to do so revoked for employing illegal workers.The permission for Chicken N Beer in Stanfield Road, Bournemouth, to sell alcoholwas removed in Mayafter immigration officials saw a man and a woman run out of it in February.A new company has applied to sell alcohol there but Dorset Police said it has ""significant concerns"" about the relationship between its owner and the man previously responsible for the bar.Cloud Brands Ltd's application for the new premises licence at Chicken N Beer will be decided by Bournemouth, Christchurch and Poole (BCP) Council's licensing sub-committee on Tuesday.The company said it would ""operate in strict adherence to licensing restrictions"" if the application is approved.But Dorset Police's licensing officer Louise Busfield said it is ""essential"" the force gets ""robust assurances"" about the relationship between the potential operator and the former company that ran it.""Dorset Police has significant concerns that this application may amount to an attempt to continue operating the premises under a new entity, while still maintaining influence or control by the former operator whose licence was revoked,"" she added.Neither of the people apprehended after fleeing Chicken N Beer earlier this year had ever got permission to work in the country, the Home Office said in May.The bar's former premises licence holder, Roy Francis, said he had resigned as a director of the company that previously ran it before the man and woman were found working there.Under the Licensing Act 2003, which is mostly managed by councils, licence holders must abide by its conditions including the prevention of crime and disorder.Get in touchDo you have a story BBC Dorset should cover?Contact formContact formYou can followBBC DorsetonFacebook,external,X,external, orInstagram,external.Related topicsHome OfficeDorsetBournemouthDorset PoliceBeerMore on this storyBar where illegal workers found stripped of licencePublished28 MayChicken bar with illegal workers could lose licencePublished20 MayRelated internet linksBCP CouncilImmigration Enforcement"
