url,title,year,text,sector,nationality
https://www.bbc.co.uk/news/10407537,Up to 1.5m drivers 'fined illegally' in London,2010,"more than a million drivers have been fined in three years

up to â£150m in fines given to motorists for traffic offences may have been unlawful, bbc london has learned.

in 2009 a motorist fined for taking an illegal turn had his penalty quashed because of the wording on his ticket.

it has now led to questions over millions of tickets issued in similar circumstances.

local councils and transport for london (tfl) have erected hundreds of signs stopping drivers from making left or right turns or carrying out other manoeuvres classed as ""moving"" traffic offences.

in the last three years about 1.5 million motorists have been fined â£120 for not obeying the ""moving"" traffic signs.

in the test case, which has just emerged, motorist zeesham sheikh challenged a ticket issued by waltham forest council for failing to comply with such a sign.

the parking and traffic appeals service (patas) upheld mr sheikh's appeal.

the adjudicator found that the wording on the ticket referred to the sign itself and not to the traffic order that legally gave it power.

for technical legal reasons patas ruled that mentioning the sign alone on the ticket was not sufficient to enforce the fine.

london councils, which represents the city's local authorities, wrote the wording which was then printed on tickets issued across the city.

parking campaigner barrie segal, who helped bring the issue to light, claims the ruling means any tickets issued with that wording were not enforceable.

he said: ""millions of pounds of london penalty charge notices are illegal.

""tfl and other local authorities will have to cancel all outstanding tickets issued and refund millions of pounds illegally claimed.""

after the adjudicator's ruling london councils amended its recommended wording for tickets issued over moving traffic offences.

that happened in october 2009 but mr segal believes any tickets issued before that date could be challenged.

moving traffic signs include those which prohibit right and left turns, u-turns, entry to and waiting in pedestrian zones and signs which prohibit motorcycles and sometimes cars in certain areas.

in 2007, 418,512 moving traffic tickets were issued in london, rising to 611,130 in 2008 with 418,512 awarded last year, totalling â£150m in fines.

nick lester, director of services for london councils, said: ""i don't know why they cancelled it [mr sheikh's ticket].

""but the adjudicator's decision does not act as a legal precedent.""

he insisted drivers who paid up in similar circumstances were too late to reclaim money, adding: ""if they don't appeal against the ticket the council has a right to say they accept culpability.""

mr lester said that, while they changed the wording, they did not accept the original phrasing was wrong.

transport for london has also been issuing fines to motorists who have not been following the signs.

a tfl spokesman said: ""tfl has complied with legislation and it is up to any individual to challenge a penalty charge notice within the appropriate time scale.""

waltham forest council said it was examining the ruling.

the disclosure comes after bbc london revealed every ticket given to members of the public using diplomatic parking bays until 2009 may have been unlawful.",not mentioned,not mentioned
https://www.bbc.co.uk/news/uk-england-london-44337438,London councils spend Â£100m on Grenfell-inspired safety work,2018,"the fire at grenfell tower in june 2017 caused the loss of 72 lives

london councils have spent nearly â£100m on safety measures in the year since the grenfell disaster, figures show.

some councils say they have had to delay refurbishing council flats to pay for the fire safety work.

croydon council says a lack of government funding has caused it to cut refurbishment work to pay for sprinklers installation in high rises.

police and fire service minister nick hurd said primary responsibility for fire safety work lay with landlords.

the nearly â£100m in spending, declared by 24 boroughs in response to bbc freedom of information requests, paid for cladding removal, operating ""waking watches"" on buildings that were found to be at risk of fire, safety surveys and other improvements.

however, some boroughs are still finding new safety issues a year after the disaster.

in barnet, north london, the agency that runs social housing for the council found 1,183 fire doors installed in its flats do not provide enough resistance to fire and will need need to be replaced.

the manse masterdor fire doors were only installed in 2013 and 2014 and will cost â£1.5m to replace.

resident malcolm sweetland said it would have been nice to spend the money on refurbishments

malcolm sweetland, who lives in one of these flats, said it was a pity so much money would have to be spent on the doors rather than other improvements, but understood why it had to happen.

""in the long run, it's better safe than sorry, isn't it?"" he said.

camden council has spent â£33m since the disaster, while newham has paid out â£20m.

kensington and chelsea says it has spent â£4.6m on fire safety improvement work, and has separately spent â£235m in responding to the grenfell disaster directly so far, exhausting its reserves.

barry craker says he is glad to see the work being done

in croydon the council has taken the decision to begin retrofitting sprinklers in its high rise blocks.

barry craker, a resident in beech house, new addington, said he was happy to have sprinklers.

""it's good, you need it done for security and safety. hopefully we won't have to use them any time soon.""

however, the council says that to install the sprinklers it has had to make cuts elsewhere.

grenfell tower fire: who were the victims?

grenfell mental health treatment 'to cost â£10m'

alison butler, cabinet member for housing, said: ""we are funding this â£10m in sprinkler work, because we are determined to do that, but that does mean that other things we hope to do, to keep our flats decent, will have to suffer and wait in the long term.""

enfield and brent councils have also had applications for government funding to fit sprinklers turned down, while newham says it has yet to receive any money from the ministry for housing, communities and local government for its safety work.

minister nick hurd said landlords in genuine financial need should approach the government

housing charity shelter said several london councils have told them they have had to delay or cut refurbishment works and fuel poverty reduction programmes to pay for safety work.

as it stands, only cladding replacement work done by councils will be government funded.

police and fire service minister nick hurd said: ""i imagine for most tenants, if asked what their primary concern was, it would be safety and wanting to feel secure in their homes, and that's the primary responsibility of the landlord which they've got to step up to.""

however, he said landlords in genuine financial difficulty should approach the government to discuss their issues.",security,not mentioned
https://www.bbc.co.uk/news/uk-england-london-49360747,Government worker stabbed outside Home Office in London,2019,"the attack took place outside the home office in marsham street, westminster

a government employee has been stabbed outside the home office in central london.

the victim, who is in his 60s, suffered non-life threatening injuries on marsham street, near the houses of parliament, just after 13:00 bst.

a 29-year-old man was arrested on suspicion of causing grievous bodily harm and possession of cs spray.

police said it was not being treated as terror-related, but they were ""keeping an open mind"" about possible motives.

items including a sheathed knife and a mobile phone were seen behind a police cordon near the home office building

the wounded man went into the building to seek assistance, an eyewitness said. the building was put into lockdown.

the ministry of housing, communities & local government said the man was a government employee.

communities secretary robert jenrick said: ""i am deeply shocked by this horrific attack on a colleague today.

""my thoughts, and those of all my staff, are with him and his family.

""we are ready to provide as much support as we can and we all wish him a speedy recovery.""

he said security will be reviewed across the department, which shares the building with the home office.

home secretary priti patel sent out atweet,externalsaying her thoughts were with the victim and his family following the ""unprovoked knife attack"".

eyewitness gareth milner said he was outside the home office when ""a number of armed police officers arrived on scene and entered the building"".

""some time later a gentleman with quite a bloodied face and with dressing pressed into his face was escorted out of the home office by paramedics,"" said mr milner.

investigations into the stabbing are continuing

he said the man was ""walking on his own two feet"".

a home office spokesperson said: ""the metropolitan police is investigating a knife attack which took place outside the home office this afternoon. the victim is receiving medical care.

""this is a deeply concerning incident and our thoughts are with him and his family.

""as this is an ongoing investigation. it would be inappropriate to comment further.""",security,not mentioned
https://www.bbc.co.uk/news/uk-england-london-37255675,London City worker in court over 'shoe death',2016,"a city worker accused of killing a recruitment consultant in retaliation at his shoe being thrown out of a minicab has appeared at the old bailey.

alexander thomson, 32, was on a night out with former colleagues on 26 august when he allegedly punched thomas hulme in the head.

mr hulme, 23, from tooting, south london, died on saturday night.

mr thomson, of broomwood road, clapham, was granted conditional bail to return to court on 26 september.",not mentioned,not mentioned
https://www.bbc.co.uk/news/uk-england-london-31148413,Criminal gangs behind illegal alcohol trade in London,2015,"a bbc inside out london investigation has uncovered criminal gangs distilling and selling potentially fatal alcohol across london

criminal gangs are producing potentially lethal alcohol and selling it in the capital, a bbc investigation has discovered.

bbc london's inside outinfiltrated two groups, one of which was targeting rough sleepers and illegal immigrants with unregulated alcohol.

one illegal still in west london said it was making â£500 a month in sales.

hm revenue and customs (hmrc) said the production of illegal alcohol was a ""dangerous activity"".

the bbc london investigation found eight illegal distilleries in london and was alerted to four more.

the gangs often operate their distilleries in the back streets of deprived areas.

kostaz, from romania, who manages a still in southall, said: ""where i come from, this is not against the law.

""you can make rum and sell it if you want. so we are just bringing the tradition here.""

harry said doctors had advised him to stop drinking illegally-produced alcohol

in the uk it is unlawful to distil and sell alcohol without a proper licence.

hmrc said chemicals used in anti-freeze and screen wash had been discovered in some counterfeit spirits.

in a statement, hmrc said: ""the public health implications of counterfeit spirits are significant, and production of illicit alcohol is clearly a very dangerous activity.

""as a result, there is a risk that drinking counterfeit spirit can lead to permanent blindness, liver failure, kidney failure and can ultimately lead to death.""

however, the operators of the illegal stills were from countries where regulations are less strict.

some of the illegal distilleries can produce several litres of whisky, vodka and rum a day, costing as little as three pounds.

harry, an illegal immigrant, has been buying illegal alcohol for more than a year and said he was addicted.

he said: ""those guys lured me in with cheap whisky and now i am addicted and seriously ill.

dr james barker, from kingston university, said illegal alcohol could lead to significant health effects

""the doctors have told me that unless i stop, my future is going to hell.""

dr james barker, from kingston university's school of pharmacy and chemistry, analysed a sample of the illegal alcohol and said it could be toxic.

""people buying this don't know what they are letting themselves in for,"" said dr barker. ""if you drink too much of this stuff, you may never wake up.""

some names and details have been changed to protect identities.

bbc inside out londonis on bbc one in the london region on monday, 9 february at 19:30 gmt and nationwide on the iplayer for 28 days thereafter.",not mentioned,not mentioned
https://www.bbc.co.uk/news/articles/cp9elj7wxpwo,What is the London mayoral election?,2024,"on thursday 2 may, londoners will head to the polls to elect a mayor and 25 london assembly members.

it's a chance for the capital's 6.2 million registered voters to decide who will run the city for the next four years.

the mayor and the london assembly represent the 8.9 million people who live in the capital.

you can vote if you meet the following criteria and are already on the electoral register:

you are over the age of 18 on the day of the election

you are a british, european union (eu) or commonwealth citizen who does not require leave to remain in the uk

the deadlines to register to vote and to apply for a postal or proxy vote have passed.

it is also too late to apply for a voter authority certificate to use in the may elections.

if you are registered to vote you (or your designated proxy) can go to your local polling station on 2 may.

you do not need to bring your polling card but you will be asked to provide valid photo id.

polling stations will be open between 07:00 bst and 22:00.

if you use a postal vote it must be with your local council by 22:00 on polling day. you can return your ballot papers by post in advance or hand them into a polling station or your local council on the day.

find your nearest polling station,external

what photo id do you need to vote in local elections?

you have three votes: one for the london mayor and two for the london assembly.

you can vote for one london assembly member to represent your constituency, and another to represent london as a whole.

the voting system for mayor has changed.

previously voters listed a first and second preference, but this time you can only vote for one candidate. under the first-past-the-post system, the candidate with the most votes will win.

the voting system for the london assembly has not changed.

if you have registered to vote, you will be sent a paper booklet which includes information about the election as well as statements from the mayoral candidates who have chosen to submit one.

the current london mayor sadiq khan is seeking re-election for a third term, and is running against 12 other candidates.

the candidates who are standing, in alphabetical order, are:

femy amin, animal welfare party - people, animals, environment

count binface, count binface for mayor of london

howard cox, reformuk - london deserves better

brian benedict rose, london real party - transform london

nick scanlon, britain first - no to immigration

the candidates vying to be the next london mayor

how would the next london mayor change the capital?

sadiq khan and susan hall clash at bbc debate

with a budget of billions, the london mayor fulfils a number of important roles.

the first istransport.they are responsible for transport for london (tfl) and have the power to set fares, which provides most of tfl's income.

they also have some powers over london roads - the congestion charge and the ultra low emission zones (ulez) both came from the mayor's office.

the mayor also influencespolicing.they set out how london is policed and staffed as well as appointing the met police commissioner and holding them to account. around 30% of the met's budget comes from the mayor, while the rest comes from national government.

in terms ofhousing,the mayor sets affordable homes targets. they liaise with local authorities and developers who receive central government funding to build affordable homes.

the mayor has very few direct powers over theeconomy, but they can support businesses in the capital and control strategic planning, which means they can approve projects that will benefit london.

they also promote london'scultureand creative industries. they mayor runs the london borough of culture scheme and employs a night czar who champions the capital's nightlife.

however, many day-to-day services such as schools, libraries and rubbish collection are run by individual london councils. similarly, the nhs, the welfare state and national tax rates are controlled by central government.

11 are selected according to the share of votes received by each party in the election for the london-wide assembly member

assembly members' main power lies in approving or rejecting the mayor's â£20.4bn budget plans.

they also work on committees which scrutinise the mayor's policies, and check if they are working.

the london assembly holds the mayor to account during mayor's question time sessions which are held 10 times a year.

what powers do the mayor and the london assembly have?

ballot papers will be verified on friday 3 may, and the votes counted on saturday 4 may.

the results will be announced at city hall later on saturday 4 may.

the mayor and assembly members take office on the second day after the results are declared, and will serve for four years.

labour's sadiq khan beat conservative rival shaun bailey to win a second term.

he had 55.2% of the popular vote, after entering a run-off with mr bailey when neither managed to secure a majority in the first round of voting.

the green party's sian berry came third, while the liberal democrats' luisa porritt was fourth.

london mayor and london assembly 2021 election results

follow bbc london onfacebook,external,twitter,externalandinstagram,external. send your story ideas tohellobbclondon@bbc.co.uk,external",not mentioned,british
https://www.bbc.co.uk/news/uk-northern-ireland-62916897,Queen Elizabeth II: The Scouts sweet shop worker helping in London,2022,"the part-time sweet shop worker says he has loved every minute of being in the scouts

when nathan quee joined the scouts as a young boy, he never imagined he would be chosen to support the smooth running of the days leading up to queen elizabeth ii's funeral.

the 18-year-old from bangor, county down, is one of nine scout leaders representing northern ireland in london asthe queen lies in state.

he was nominated to take part and faced ""a nerve-wracking"" selection process.

it is ""a once-in-a-lifetime opportunity"", he told bbc news ni.

""the queen has played a big part in my life so it's an honour to be selected,"" said the bangor academy pupil.

""i'm here, absorbing every moment of this momentous occasion, taking in everything i can.""

nathan, who is part of 2nd bangor abbey scouts, has been working through the night, as part of his role in london.

this has involved supporting the stewards who have been managing the queue to pay respect to the queen as she lies in state.

over the past few days,thousands of people have queued along the banks of the river thames.

he has also helped people who require accessibility measures and at a bag drop-off.

""the atmosphere within the group and within london is amazing,"" he said.

people queuing on london's south bank to pay their respects at the queen's lying-in-state

""the city is buzzing with people queuing to see her majesty queen elizabeth and everyone in terms of police, the military and the stewards are all doing an amazing job.""

he said people on the mall, which leads to buckingham palace, were ""almost throwing themselves on each other to try and get a view"" of the royal family on wednesday.

""seeing how quickly london turned around in terms of busy and loud to quiet and respectful, it's an atmosphere i'll never forget and i'm so glad to be apart of it.""

when he's not ""scouting around the place"", nathan is studying for three a-levels at bangor academy, where he is deputy head boy, and works part-time in a sweet shop.

for him, the queen led by example: ""she was the person that we all looked up to.""

nathan enjoys his job in a local sweet shop

""she was the perfect role model on how to conduct our daily lives. her dedication to public service was unwavering,"" he said.

""she represented everything that's great about being british and the people of northern ireland will certainly have a deep void in our lives now she's gone.

""as my dad says, the queen was like everyone's nanny - always there in the background, making sure everyone was ok.""

what is closed in northern ireland on day of queen's funeral?

while his employers at curious candy believe ""there isn't a better person who could be there"", nathan says he is just glad he can help during this period of mourning.

""it has shown how much the queen and royal family mean to everyone.

""this is something i'll never forget. i am so proud to represent the people of northern ireland by being here and i'm just glad i can pay a little back by doing my duty in helping people at this very sad time.""

'mourning but celebrating' king charles's ni visit

in pictures: charles on first visit to ni as king

how do royal roles differ in northern ireland?",shop,british
https://www.bbc.co.uk/news/av/uk-england-london-67826799,Alexandra Palace: Working to restore a north London icon,2024,"alexandra palace is being given a birthday repair job for its 150th anniversary.

the grade ii listed site between wood green and muswell hill in north london has received â£550,000 from historic england to start work on restoring its derelict old offices, which the palace team says is the last inaccessible area of the seven-acre site.

affectionately known as 'ally pally', the building first opened in 1875 and has a long and rich history, hosting sporting events, ice skating, exhibitions and was even home to the bbc in the early days of television.

video by luxmy gopal, david perella & dave godfrey",not mentioned,not mentioned
https://www.bbc.co.uk/news/av/uk-england-london-33126021,Tower Bridge in London to close for repair work,2015,"tower bridge, one of london's busiest river crossings, is set to close for three months next year so repairs can be carried out.

the victorian structure has not had any work carried out on it for 25 years.

chris earlie, tower bridge business manager, said timber decking on the bridge was in need of repair and the bridge would be closed to traffic and pedestrians over the winter months.

but motorists said they were shocked by the news and that the closure would cause chaos. bbc london's ayshea buksh reports.",not mentioned,not mentioned
https://www.bbc.co.uk/news/uk-england-london-44643348,'Sex work and overcrowding' at London lets investigated,2018,"it is illegal to let a property for more than 90 days without gaining the council's permission

sex work, parties and overcrowding have all been uncovered in short-term let properties, a london council has said.

westminster city council is looking at 1,200 properties after it issued 75 breach notices to owners using online accommodation rental sites.

it said some households let properties to short-term guests on nearly every night of the year.

two of the bigger companies, airbnb and homeaway, said they had not received complaints from westminster council.

an airbnb spokesperson said: ""there are many home-sharing platforms in westminster.

""airbnb is the only one that works with london to promote the rules and limit how often hosts can share their homes - others need to step up and do the same.""

homeaway said it was working ""closely with the council to identify and address concerns and together with the short-term rental industry, we work on appropriate solutions for all parties involved"".

households must apply for planning permission if they want to let a property for more than 90 days a year.

airbnb said it did not allow users to accept more bookings than the legal limit, unless their owners have planning permission.

however, the council says landlords and tenants are sub-letting to get around airbnb's rules by offering the rooms on multiple platforms such as homeaway.

westminster city council said it had issued 75 breach notices to short-term let properties

council leader nickie aiken said some people may not know the 90-night limit exists,according to the local democracy reporting service.

but she warned the council was taking a tough approach, adding the proliferation of short-term visitors were upsetting residents in the borough.

she said: ""we have no problem with people earning a little extra money by letting their home considerately within the limits.

""but those who are breaching the 90-night limit and letting 365 days a year are a blight on the lives of our residents.""

it is estimated that in westminster there are 4,703 airbnb listings, comprising 3,284 entire homes, 1,378 private rooms, and 41-shared rooms.

westminster council has invested â£200,000 in a housing standards taskforce, which it set up last year.

the project will collect evidence on properties suspected of breaching the 90-night limit, and target landlords renting out sub-standard properties.

this story has been amended following a comment provided to the bbc by homeaway.",not mentioned,not mentioned
