URL,Title,Date,Text
https://www.bbc.co.uk/news/articles/cr4ze0x3z0wo,Nine arrested on suspicion of working illegally,2025-05-23T15:23:32.284Z,"Nine arrested on suspicion of working illegallyImage source,GoogleImage caption,The arrests were made in Green Lane in OutwoodPublished23 May 2025Nine people have been arrested by a Home Office immigration enforcement team on suspicion of working illegally as delivery drivers in Surrey.They were detained at a caravan site in Green Lane, Outwood, in the early hours of Tuesday, said the Home Office.Five Brazilian men, one Brazilian woman, two Indian men and an Indian woman were arrested on suspicion of ""substituting for delivery riders and completing food deliveries on their behalf without the right to work in the UK,"" a Home Office spokesperson said.Seven of those arrested were placed on strict immigration bail and are required to report regularly to the Home Office.â¯Two individuals have been detained pending their removal from the UK.Follow BBC Surrey onFacebook,external, onX,external, and onInstagram,external. Send your story ideas tosoutheasttoday@bbc.co.uk,externalor WhatsApp us on 08081 002250.Related topicsHome OfficeRedhillRelated internet linksHome Office"
https://www.bbc.co.uk/news/uk-england-norfolk-68685165,Loddon Indian restaurant loses licence for month over illegal workers,2024-03-28T13:24:18.000Z,"Loddon Indian restaurant loses licence for month over illegal workersPublished28 March 2024Shareclose panelShare pageCopy linkAbout sharingImage source,GoogleImage caption,The Raj can remain open but cannot serve alcohol for a monthByEleanor StoreyLocal Democracy Reporting ServiceAn Indian restaurant has had itsÂ alcohol licence temporarily suspended due to modern slavery concerns, despite Home Office recommendations of a harsher penalty.The Raj, on Bridge Street in Loddon, Norfolk, was raided in October by an immigration enforcement team.Two illegal workers were arrested and Raj manager Mohammad Uddin admitted not making the proper checks.South Norfolk Council revoked his licence for a month.Last year, two out of four staff members at the restaurant were found to be working illegally.The Home Office also found that Mr Uddin was compensatingÂ his workers by giving them food, rather than financial payment.Mr Uddin denied the claims and said the menÂ were there to do some cash-in-hand cleaning jobs, and had never worked at the restaurant before.The Home Office recommended the premises' licence be taken away.However, councillors chose to disregard the advice of the Home Office due to Mr Uddin's lack of previous warnings.During his hearing at South Norfolk Council, Mr UddinÂ said: ""I've been running this restaurant for many years and I haven't experienced anything like this in my life.""I was so scared when the officers arrived, there were so many of them. It caused me to say things I did not mean.""I have now understood that I must do the proper checks for anyone coming to do any kind of work.""I want to thank everyone in Loddon. All of the local peopleÂ have supported me.""Follow East of England news onFacebook,external,Instagram,externalandX,external. Got a story? Emaileastofenglandnews@bbc.co.uk,externalor WhatsApp 0800 169 1830Related topicsLoddonMore on this storyRestaurant owner denies modern slavery offencesPublished19 March 2024Home Office recommends Indian restaurant closurePublished9 March 2024Around the BBCLocal Democracy Reporting ServiceRelated internet linksSouth Norfolk CouncilThe BBC is not responsible for the content of external sites."
https://www.bbc.co.uk/news/uk-northern-ireland-68669224,FP McCann: Concrete firm could face fine for illegal workers,2024-03-26T17:04:18.000Z,"FP McCann: Concrete firm could face fine for illegal workersPublished26 March 2024Shareclose panelShare pageCopy linkAbout sharingImage source,Getty ImagesTwo firms could face fines after 13 illegal workers were arrested during an immigration raid.Twelve men and a woman were arrested in north Wales on 19 March.FP McCann, a concrete supplier based in County Londonderry, has been referred for a penalty of up to Â£225,000 for employing five illegal contractors.Adana Construction, from Stockport, has been referred for a penalty of up to Â£180,000 for employing four illegal workers.""Illegal working causes untold harm to communities, puts vulnerable people at risk, defrauds the public purse and undercuts honest employers and jobseekers, HM Insp Ryan Moore said.""This operation was a huge success and I thank our officers who executed it expertly"".The Home Office said the operation at the former paper mill where the workers were arrested was launched in response to concerns raised by the public.Shotton Mill is being converted to a containerboard factory.The 13 people arrested were working as subcontracted labourers and steel-fixers.  The Home Office said they would now be removed from the UK.How the system worksBoth companies were issued with civil penalty referral notices, pending a review of evidence from the site visit and company records.Under the civil penalty process, a referral notice is issued if officials determine they have found illegal workers and there is no statutory excuse for employing them.At that stage the company can provide further evidence that it wants to be taken into account when determining liability and the level of any penalty.The civil penalty can also be challenged in court. Fines for employing illegal workers were significantly increased in February.The maximum civil penalty for a first breach increased from Â£15,000 a worker to Â£45,000 a worker.This article was amended on 28 March 2024. In its original statement the Home Office said the two firms had been fined. It subsequently clarified that they had been referred for civil penalty notices.Related topicsUK immigrationHome OfficeImmigrationNorthern Ireland"
https://www.bbc.co.uk/news/uk-england-gloucestershire-67101727,Cheltenham Koloshi Restaurant loses licence over illegal workers,2023-10-13T12:52:43.000Z,"Cheltenham Koloshi Restaurant loses licence over illegal workersPublished13 October 2023Shareclose panelShare pageCopy linkAbout sharingImage source,GoogleImage caption,Kolishi Indian Restaurant and Bar has had its premises licence revokedByCarmelo GarciaLocal Democracy Reporting ServiceAn Indian restaurant has been banned from selling alcohol, following a Home Office raid which found six illegal workers at the premises.Koloshi Indian Restaurant on London Road had its premises licence reviewed and revoked by Cheltenham Borough Council this week.The restaurant previously had a licence to sell alcohol every day from 09:00 to midnight.However, the Home Office requested a review of its licence in April.Officers visited the restaurant on 1 April and found six illegal workers, said theLocal Democracy Reporting Service.In August, Koloshi Gold (GB) Ltd was fined Â£90.000 for employing six people who did not have the right to work in the UK.Legal representatives for the licensee told the licensing sub-committee on 11 October he could not comment on what the Home Office representatives said in relation to the raid and the finding of illegal workers there.""My client became the owner subsequent to that. My client didn't know about this raid until he learnt from the council about the review.""He said they were not there to justify anything that had happened during the previous ownership.His client has not had any issues with illegal working in 25 years of being in the industry, he said.""He appreciates the damage that it does to the country and the people. It is a bona fide change of ownership.""'Questions over exploitation'Licensing chairman David Willingham said the committee was unanimous in its decision to revoke the premises' licence.""Six workers with immigration issues suggest complicity in providing work for trafficked individuals. This raises questions over exploitation, failure to pay national insurance and tax and national minimum wage.""He said given the rapid sale of the business for Â£100,000 a lot more due diligence should have been undertaken.""People related to the company Koloshi Gold are still involved with the company Three Gold.""On balance of probabilities the committee thinks the owners and the documentation still show evidence of control by Koloshi Gold and CBS Properties Limited.""The committee is concerned these are all interconnected with the company Three Gold.""The committee is concerned the current owner could still facilitate illegal working.""Follow BBC West onFacebook,external,X,externalandInstagram,external. Send your story ideas to:bristol@bbc.co.uk,externalRelated topicsGloucestershireCheltenhamMore on this storyIndian restaurant closed after immigration raidPublished21 September 2023Restaurant to appeal against alcohol sale banPublished24 April 2023Restaurant loses licence over illegal workersPublished19 April 2023Around the BBCLocal Democracy Reporting Service - Local News Partnerships"
https://www.bbc.co.uk/news/articles/c0je7nxx2v9o,Thousands of illegal cigarettes seized from shop,2025-12-03T14:35:51.383Z,"Thousands of illegal cigarettes seized from shopImage source,West Mercia PoliceImage caption,Hundreds of packets of illegal cigarettes have been seized with the help of Griff the tobacco detection dogByElliot BallWest MidlandsPublished3 December 2025Hundreds of packets of illegal cigarettes and tobacco and more than Â£17,000 in cash have been seized from a premises in Herefordshire, police have said.The items were discovered at Rayan Mini Market in Drapers Lane, Leominster, on Tuesday following concerns around illegal sales.Griff the tobacco detection dog was deployed to assist in searches, which recovered 157 pouches of illegal hand-rolling tobacco and 406 packets of cigarettes from a vehicle at the back of the premises.The total duty evasion for these items has been calculated at Â£9,704.78. A total of Â£17,350 in cash was also found concealed inside a fridge within the shop.An interim closure order has been put in place at the store pending a hearing at Hereford Magistrates' Court, where a further closure order is being sought.Sgt Duncan Reynolds said: ""We will continue to target stores suspected of selling counterfeit tobacco and illicit vaping products to protect our communities from harm, and act where appropriate.He added: ""The black market for illegal products undermines legitimate retailers and is often connected to organised criminal gangs and modern-day slavery.""Get in touchTell us which stories we should cover in Hereford & WorcesterContact formContact formFollow BBC Hereford & Worcester onBBC Sounds,Facebook,external,X,externalandInstagram,external.Related topicsTrading StandardsLeominsterMore on this storyHundreds arrested in High Street crime crackdownPublished11 NovemberThousands of vapes and cigarettes seized in raidsPublished25 JulyRaids uncover Â£25k of illegal cigarettes and vapesPublished11 JuneRelated internet linksWest Mercia Police"
https://www.bbc.co.uk/news/uk-england-birmingham-65929536,Birmingham raids in crackdown on illegal workers,2023-06-16T12:50:20.000Z,"Birmingham raids in crackdown on illegal workersPublished16 June 2023Shareclose panelShare pageCopy linkAbout sharingImage caption,An operation was carried out at a warehouse in QueslettByBen GodfreyCorrespondent, BBC Midlands TodayTwelve arrests have been made after immigration enforcement officers carried out raids in Birmingham as part of a crackdown on illegal workers.Arrests included five males from Nova Services Group, the Home Office said, following an operation at a warehouse.The BBC has asked the company - owner of the Queslett site - for comment.Inspectors said among issues faced in the region were suspicions that foreign nationals were breaching student visa conditions by not attending courses.The Home Office added that over the past year in the West Midlands, immigration enforcement teams had made more than 700 arrests, with only about half the individuals detained for deportation.Image caption,The warehouse was suspected of employing individuals who were working illegallyOf the Queslett leg of the operation on Thursday, HM Inspector Matt Foster, from Home Office Immigration Enforcement, said: ""We're looking that potentially these individuals are either not complying with the condition of the stay, i.e. they're not studying, or they're working in excess of 20 hours per week.""[That] is prohibited on the visas that these individuals currently hold.""Later the Home Office confirmed five males from India had been arrested, with a woman from the same nation held after a follow-up house search.It added that of the five males, one was a student working in breach of rules and two were ""student overstayers"".The firm was served with a civil penalty notice for a total potential fine of up to Â£100,000, the Home Office said.Image caption,HM Inspector Matt Foster said illegal working was ""rife across the UK""There were also visits to two car washes in the city and a construction site.In total, 12 arrests were made and there was ""a total civil penalty liability of Â£180,000"".Mr Foster said: ""It's important that we protect the resident workforce and ensure that individuals are working legitimately and paying tax accordingly.""The arrests were part of a series of nationally-coordinated operations.This raids come as the Illegal Migration Bill goes through Parliament in a bid to curb the numbers of people arriving in the UK illegally.Follow BBC West Midlands onFacebook,external,Twitter,externalandInstagram,external. Send your story ideas to:newsonline.westmidlands@bbc.co.uk,externalRelated topicsBirminghamRelated internet linksHome OfficeThe BBC is not responsible for the content of external sites."
https://www.bbc.co.uk/news/uk-england-somerset-65311650,Posh Spice restaurant in Nailsea loses licence over illegal workers,2023-04-19T06:16:08.000Z,"Posh Spice restaurant in Nailsea loses licence over illegal workersPublished19 April 2023Shareclose panelShare pageCopy linkAbout sharingImage source,GoogleImage caption,Restaurant Posh Spice can no longer sell alcohol or serve hot food after 23:00ByJohn WimperisLocal Democracy Reporting ServiceA restaurant has been stripped of its licence after it was found to be employing illegal workers.Three people who had been working illegally at Posh Spice in June 2022 were found to still be at the restaurant during a raid in February.Immigration Enforcement called for a review of the Nailsea restaurant.On Monday, North Somerset Council revoked the restaurant's licence to serve alcohol and late-night food.The licensing subcommittee meeting had earlier been suspended for more than an hour as staff tried to get in touch with immigration officials after they failed to attend.Jasmine Miah, the daughter of licence holder Golap Miah, said the wait had left her father feeling anxious.Speaking while waiting for the meeting to resume, she said: ""I don't want any pressure on him, whatever the outcome.""The meeting resumed with Jonathan Watson of Immigration Enforcement joining by video link.Mr Watson confirmed that none of the three individuals had the right to work at the restaurant at the time of the February raid, although one had been granted it three weeks later.Another individual had previously been allowed to work for 20 hours a week as a student, but this had been revoked as he was not enrolled to study.The other had the right to work in some professions, where there were shortages of workers, but not at a restaurant.Posh Spice will no longer be able to sell alcohol or serve hot food after 23:00.Follow BBC West onFacebook,external,Twitter,externalandInstagram,external. Send your story ideas to:bristol@bbc.co.uk,externalRelated topicsUK immigrationNorth Somerset CouncilNailseaMore on this storyFormer nightclub set to be turned into restaurantPublished20 January 2023Club could lose licence after alleged incidentsPublished9 January 2023Related internet linksImmigration EnforcementNorth Somerset CouncilThe BBC is not responsible for the content of external sites."
https://www.bbc.co.uk/news/uk-england-lincolnshire-62826181,Holbeach: Restaurant owner admits employing illegal workers,2022-09-08T05:12:21.000Z,"Holbeach: Restaurant owner admits employing illegal workersPublished8 September 2022Shareclose panelShare pageCopy linkAbout sharingRelated topicsCoronavirusImage source,LDRSImage caption,An investigation in April found that of the eight workers present at the restaurant five were working without the correct permissionsAn Indian restaurant owner in Lincolnshire has said he employed illegal workers to stay open after the Covid pandemic.Siddique Faud Rahman, from the Chameli Indian Tandoori restaurant in Holbeach, faced a licensing committee on Tuesday.Five of his workers were found without the correct permissions during an investigation in April.The committee said it was not satisfied the premises would not employ illegal staff again and revoked his licence.When he appeared before South Holland District Council's licensing committee on Tuesday Mr Rahman, denied being involved in ""modern slavery"" but told councillors: ""I'm going to put my hands up, yes, we employed illegal workers.""He said because of the Covid lockdown his business had struggled to pay overheads and after the furlough scheme a number of his workers had not returned.""I had to get some staff working, or I would have to close my business down,"" he said.Mr Rahman added: ""The workers were paid above minimum wage, plus accommodation and food â¦ there was no modern day slavery. They were loved and cared for as my own family.""Image source,LDRSImage caption,South Holland District Council's licensing committee said it ""could not condone a deliberate decision to flout the law""The Local Democracy Reporting Servicesaid Mr Rahman told councillors: ""If this license is revoked then we will probably have to close down the business because we cannot survive.""Sgt Lee Cotton from Lincolnshire Police, told the committee: ""I appreciate the difficulties with the furlough scheme, but responsible businesses do not employ illegal workers.""They take the necessary steps to employ legal workers.""Revoking the licence, the committee said the ""calculated risk"" taken by the business meant they ""could not be satisfied the premises would never resort to employing illegal workers again if it faced difficult conditions.""Councillor Paul Redgate said: ""You keep saying you had no choice, everyone has a choice, you made the decision not to employ legal workers.""Follow BBC East Yorkshire and Lincolnshire onFacebook,external,Twitter,external, andInstagram,external. Send your story ideas toyorkslincs.news@bbc.co.uk,external.Related topicsHolbeachLincolnshire PoliceCoronavirusAround the BBCLocal Democracy Reporting Service - Local News Partnerships"
https://www.bbc.co.uk/news/uk-england-tees-56815659,Restaurant owner 'paid' illegal workers with diners' leftovers,2021-04-20T10:56:17.000Z,"Restaurant owner 'paid' illegal workers with diners' leftoversPublished20 April 2021Shareclose panelShare pageCopy linkAbout sharingImage source,GoogleImage caption,Akbar Dynasty had been raided several times by immigration officersA restaurant owner who ""paid"" illegal workers with diners' leftover food has had his licence revoked.Staff at Akbar Dynasty in Sadberge, near Darlington, hid in toilets or posed as customers during an immigration raid in 2020, Darlington Council's licensing committee heard.During interviews one worker told officers he was paid with whatever was ""left at the end of the night"".The Home Office sought the revocation of Abdul Mannan Shabul Ali's licence.The council was told Mr Ali had been fined Â£35,000 in 2019 for employing illegal workers at the 50-seat eatery after he showed no evidence that he made any checks on the eligibility of workers.A Home Office immigration enforcement officer told councillors the ability to work without authorisation, as Mr Ali had allowed to happen, is a key driver of illegal migration, theLocal Democracy Reporting Service said.The officer added: ""It encourages people to take risks in trying to enter the UK illegally by putting their lives in the hands of unscrupulous people smugglers and leaves them vulnerable to exploitative employers.""'Warning shot'Officers told the hearing Akbar Dynasty, which opened in 2009 in a former Little Chef premises, had been repeatedly raided by immigration officers.During one inspection in 2019, a worker was found hiding in a toilet and another, whose hands and clothes were stained red from curry, was sitting at a table posing as a customer.Mr Ali, who represented himself, said he had no knowledge of the 2019 raids and claimed he had taken over the restaurant the following year.The restaurant was raided again in February 2020 with officers interviewing workers,according to a report to the council,external.When asked how he was being paid, one worker said: ""Food, whatever is left at the end of the night.""Mr Ali said someone had turned up for an interview on the day that officers raided the restaurant.Mr Ali, of Keighley, West Yorkshire, told the committee: ""He didn't tell me at the time that he didn't have his work permit. He wasn't an immigrant, he had the legality to stay in this country. He was just waiting for his work permit permission, which was granted just two months later.""However, immigration officers told the committee the worker in question had been ""wearing a waiter's costume and attending a table when officers entered the premises"".The committee's chairman, Councillor Brian Jones, said he hoped the case would be a ""warning shot"" to other restaurants.Follow BBC North East & Cumbria onTwitter,external,Facebook,externalandInstagram,external. Send your story ideas tonortheastandcumbria@bbc.co.uk,external.Related topicsKeighleyHome OfficeDarlingtonDarlington Borough CouncilRelated internet linksDarlington Borough CouncilThe BBC is not responsible for the content of external sites."
https://www.bbc.co.uk/news/articles/clydd7zeye7o,US judge says mass firings of some federal workers likely illegal,2025-02-28T15:01:53.807Z,"US judge says mass firings of some federal workers likely illegalImage source,Getty ImagesByAna FaguyBBC News, Washington DCPublished28 February 2025A California judge has said the mass firings of probationary employees by the Trump administration were likely unlawful.The ruling said the Office of Personnel Management (OPM) had told thousands of employees across a handful of federal agencies they were fired using authority the agency does not have, US District Judge William Alsup ruled.""[OPM] does not have any authority whatsoever, under any statute in the history of the universe, to hire and fire employees at another agency,"" he said. ""They can hire and fire their own employees.""In court the government argued OPM asked, not ordered, the agencies to fire these employees.They also argued that probationary employees are not guaranteed employment and that only the highest performing and mission-critical employees should be hired.Government workers have been the target of the Trump administration's efforts to reduce the federal workforce in the name of cutting costs.Many employees affected by the firings are probationary employees - usually those in their first or second year in a job - though they can sometimes be long-time employees who were recently promoted.There are some 200,000 probationary employees in the federal workforce.Judge Alsup ordered OPM to revoke its directives to multiples agencies - including the Department of Veterans Affairs, the National Park Service, and the Defence Department - to terminate employees.He issued a temporary restraining order which puts a momentary pause on the government's actions until a judge revisits the matter in the coming weeks.The case began after a coalition of labour unions and non-profit organisations sued the government, arguing OPM unlawfully fired individuals by falsely claiming workers were performing poorly.Everett Kelley, the National President of the American Federation of Government Employees, called the ruling a victory for Americans were were ""illegally fired"" from their jobs by an agency with ""no authority to do so"".""These are rank-and-file workers who joined the federal government to make a difference in their communities, only to be suddenly terminated due to this administration's disdain for federal employees and desire to privatize their work,"" he said.OPM declined the BBC's request for comment.Related topicsUS governmentDonald TrumpUnited StatesMore on this storyHundreds in US climate agency fired in latest cutsPublished28 FebruaryTens of thousands of federal workers accept Trump resignation offerPublished6 FebruaryFederal workers left confused as Musk doubles down on threatPublished25 FebruaryKey US agencies tell staff not to answer Musk email on what they did last weekPublished25 February"
