url,title,year,text,sector,nationality
https://www.bbc.co.uk/news/uk-england-london-56948685,Sian Berry: 'I developed my conscience working in London',2021,"sian berry said she ""developed a conscience"" while working as a medical writer for a pharmaceutical company

sian berry joined the green party 20 years ago after ""developing a conscience"" while working for a pharmaceutical company. ms berry, who is making her third attempt to become mayor of london, explains how she wants to run the capital from ""the bottom up"" after being ""the average londoner"" for most of her adult life.

""i've always worked,"" ms berry said. ""i've worked since i was 14 because i needed to.""

now 46 years old, ms berry is the co-leader of the green party, a london assembly member and a councillor. she also volunteers at her local library.

her route to political prominence has not been straightforward, and it was driven by a need ""to keep the lights on"", she said.

""when i came to london all i had was my overdraft and my degree. i started working in offices as a temp because i'd learned to type in a previous job.""

sadiq khan: 'i neverâ wanted to be a culture war poster boy'

shaun bailey: 'politics isn't scary when you've seen stabbings'

luisa porritt: 'this is one glass ceiling yet to be shattered'

what do the mayor of london manifestos say?

after graduating with a degree in materials science from oxford university, she says her most employable skill was ""being good at excel and doing mail merges"".

ms berry ended up working as a medical writer ""writing to doctors on how different cold medicines work"".

""after a few years i developed a conscience,"" she said. ""it was a really, really interesting job, but in the end i was working for a big pharmaceutical company.

""some of the work i was doing was trying to market drugs for things that shouldn't necessarily be medicalised.""

ms berry said she ""very gradually moved to becoming someone who full time tried to change the world""

through watching the news and reading up on climate change she ""started to learn how the world worked"".

""i made a conscious decision to change my career and i don't regret it.""

it was at about this time she started attending protests and marches in london.

""i would pick up leaflets from everybody and take them home and read them. that was the first time i was ever in contact with the green party.""

after her self-described ""quarter-life crisis"" ms berry began working for charities ""learning an awful lot about campaigning"" and ""filling in gaps in what the government provide"".

ms berry said her political awakening came through attending protests in london

her experiences inspired her to start running for political roles and branching out into activism.

ms berry ran for camden council first in 2002.

at about this same time, she founded the alliance against urban 4ã4s, which received national attention after she began leaving fake parking tickets on cars around camden and westminster.

during this period she began working as a web designer at the department of medicine at imperial college, london.

when her unit at imperial span off to become a tech start-up, she was eyeing up her first bid for the top job in london.

she ran for mayor of london in 2008, coming in fourth and losing her deposit.

sian berry is co-leader of the green party alongside jonathon bartley

but her star was rising within the green party. alongside writing several books on living a more eco-friendly life, she held a series of spokesperson roles.

others were taking notice of her activities as a campaigner.

the met police began secretly monitoring ms berry, along with other key green party members, according toa newspaper investigation.,external

she declined to comment on the experience. but at the time she accused the police of ""wasting time and our money snooping on green politicians and campaigners who they think might want to change the status quo"".

in 2014 ms berry eventually won a seat on camden council. two years later she won a seat on the london assembly, where she now  sits as one of two green party representatives.

in 2018 she became co-leader of the green party along with jonathon bartley.

ms berry said: ""i very gradually moved to becoming someone who full time tried to change the world.

what's happening:on 6 may, people will vote to elect a mayor and 25 members of the london assembly. together they form the greater london authority, which governs the capital.

why does it matter?the mayor has a â£19bn budget, is responsible for transport and policing and has a role in housing, planning and the environment. the london assembly holds the mayor to account.find out more here.

who is standing?there are 20 candidates running for london mayorand a full list can be found here.

""all the way through this i never really earned enough.

""i've always been the very average person in london. i think my salary tracked the average salary in london for 20 years.""

this, she says, is the inspiration behind her political beliefs.

""i know what genuinely running out of money means. i know exactly how much â£20 can mean to you at the end of the month.

""it's just the empathy i can have with people is just bigger because of having lived this very normal life.""

as mayor, ms berry said she would get more ""normal people"" involved in decision-making.

""we want to make sure ideas on how we change society come from the bottom.

""you can tackle global issues and do it at a more local level.

""but that's a mess i'd prefer to have than a whole population feeling like they're not being listened to, which is what we have at the moment.""",not mentioned,not mentioned
https://www.bbc.co.uk/news/av/uk-england-london-51561209,Fears over trafficked prostitutes forced to work openly in London,2020,"residents in north london are calling for action to stop the trafficking of prostitutes who are forced to tout openly on their streets.

they say theyâre living in fear of attack by pimps if they complain. the met police says it's cracking down - but what will it take to stop this evil trade?

this story will be featured on bbc london tv news and inside out on bbc one in london on monday 17 february at 19:30 gmt and afterwards onbbc iplayer.",not mentioned,not mentioned
https://www.bbc.co.uk/news/articles/cglxx3dd59do,Work on railways set to cause Easter disruption,2025,"thameslink, southern and southeastern trains are due to be impacted

train services in south london will be disrupted over the easter weekend due to a major programme of railway upgrades, network rail has said.

a railway junction at battersea will be rebuilt, a new signalling system in lewisham will be installed and new track will be laid on the bromley north branch line.

network rail urgedpassengers to plan ahead,externalfor the easter period, with thameslink, southern and southeastern trains all due to be affected.

david davidson, network rail's kent route director, said: ""while we are reminding people to plan ahead and check their journey, more than 90% of the network is open and trains are running.""

the work means southeastern trains to and from london victoria will be diverted to london cannon street, london charing cross or london blackfriars from 18 to 21 april. brixton station will also be closed.

a reduced southern service will run between london victoria and clapham junction and east croydon, with no trains calling at battersea park towards london victoria.

trains which usually run between london victoria and london bridge will also not be in service, nor will trains between london bridge and epsom.

rail services between london victoria and littlehampton, eastbourne and reigate will also be affected.

on 20 and 21 april, trains on the bexleyheath line in southeast london will not run.

and from 18 to 21 april, buses will replace trains between grove park, sundridge park and bromley north.

listen to the best of bbc radio london onsoundsand follow bbc london onfacebook,external,x,externalandinstagram,external. send your story ideas tohello.bbclondon@bbc.co.uk,external",not mentioned,not mentioned
https://www.bbc.co.uk/news/uk-england-london-18447470,London tourist's illegally parked car blown-up by police,2012,"nima hosseini razi says he went to see buckingham palace after his car broke down

a london tourist had his car blown up by anti-terrorist officers after it broke down - and he was also given a parking ticket.

nima hosseini razi, 32, said his ford mondeo had broken down in early hours of wednesday close to the houses of parliament and westminster abbey.

he said he had left a note on the car to say: ""this car is broke. please do not fine me,"" before going sightseeing.

but when he returned hours later, ""the boot was blown off"".

a metropolitan police spokesman said: ""we can confirm there was a suspect vehicle at storey's gate at 10.20am on wednesday and a controlled explosion took place... the incident was subsequently deemed as non-suspicious.""

westminster conservative councillor daniel astaire said: ""on this occasion the driver was parked in a very dangerous place, on yellow lines, so police instructed our parking attendant to issue the driver with a ticket.""

mr razi, who is studying for an mba at the university of wales, said he had left a note on his car explaining: ""dear sir or madam, this car is broken. i am just waiting for the aa to arrive. please do not fine! thank you, yours sincerely.""

he said he had gone off to visit some of london's sights, including buckingham palace, but when he returned to the car ""the windows were smashed in pieces. i was completely shocked"".

""police wanted to remove the car. they covered the car with some of my stuff left in it.

he added: ""the police's actions were extremely arrogant and unprofessional.

""they treated me like a terrorist. they were never interested in listening to my real story.""

scotland yard has not responded to mr razi's comments.",not mentioned,not mentioned
https://www.bbc.co.uk/news/10211958,London black cabs block streets over illegal minicabs,2010,"motorists have faced long delays around aldwych, central london, after scores of black cab drivers blocked streets in a protest over illegal minicabs.

licensed black cab drivers claim the minicab trade is not policed properly and unlicensed drivers touting for business pose a danger to the public.

the blockade began at 1500 bst leading to delays near the strand and roads leading to and from waterloo bridge.

drivers drove around the aldwych roundabout leading to long queues.

the hour-long protest had a knock-on effect on traffic in the run-up to rush hour.

more than 6,000 illegal drivers have been arrested since 2003, metropolitan police said.

black cab drivers have accused the police, the mayor and local authorities of not doing enough to tackle illegal minicabs.

they have claimed their complaints are ignored and passengers lives are being put at risk.

a spokesman for the protesting drivers said: ""it is time that the various bodies start to treat the licensed london taxi trade with the respect it deserves.

""it is consistently voted the best taxi trade in the world and does more for london's tourist trade than all the above authorities put together.

""we are sorry that we have to block the streets to make our voices heard, but we feel we have no other option.""

a metropolitan police spokesman advised motorists to avoid travelling through the area during the protest.

a spokesman for its cabs enforcement unit (ceu) said: ""since 2003, the safer transport command has arrested more than 6,000 illegal cab drivers and has doubled the number of dedicated cab enforcement officers in the capital to 68.

""the ceu carry out operations on a daily basis in line with current intelligence on touting behaviour.

""they also co-operate with clubs to crack down on the touts who operate in the area and ensure compliance with regulations and importantly enhance the safety of the travelling public.""

a spokesman for the mayor of london said: ""we introduced the one strike and out policy for both drivers and operators and have revoked over 250 licences to date.

""any operator found to be employing staff that we find touting on street will have their licence revoked.""",taxi,not mentioned
https://www.bbc.co.uk/news/uk-england-london-45603915,B&M fined for illegal knife sales to east London teens,2018,"b&m bargains was handed a court bill of 492,598.53

retailer b&m bargains has been fined a record â£480,000 for repeatedly selling knives to children as young as 14 in east london.

four teenagers were sent to stores in barking and chadwell heath by police and trading standards officials.

in june b&m retail admitted to three counts of selling knives to under-18s.

the guilty plea meant the company's initial fine of â£720,000 was reduced by a third at barkingside magistrates' court.

during sentencing district judge gary lucie said b&m bargains had failed to put in a system which would stop children buying knives.

he said: ""knife crime is at record levels across the country, particularly in london.

""one of the most concerning failures is that b&m did not implement other systems. this includes putting knives in cupboards as it does with perfume.""

the court heard that two teenagers, aged 14 and 15, were sent into theâ chadwell heathâ b&mâ to purchase knives on 19 september, 2017.â

two days later the vicarage field store in barking was visited by a 16-year-old who picked up aâ three-piece knife set.

in january a 14-year-old was sent into the same store to buy a blade.

during all of the undercover operations the teenagers were able to purchase knives completely unchallenged by staff.

b&m has 28 days to pay the â£480,000 fine, plus â£12,428 court costs and a â£170 victim surcharge.",retail,not mentioned
https://www.bbc.co.uk/news/uk-england-london-19948654,One in five workers on poverty wages: Trust for London,2012,"one in five people working in london is being paid ""poverty wages"", a charity has claimed.

the study said the number of jobs paying below the so-called ""london living wage"" had risen by 100,000 to 580,000 between 2010 and 2011.

last year mayor boris johnson raised the recommended minimum hourly wage to â£8.30, a rise of 45p.

trust for london, which funded the study, said the living wage benefited workers, employers and the government.

the anti-poverty charity said the government could save almost â£1bn a year if companies paid the wage in london, due to extra taxes and less spending on welfare.

meanwhile a spokesperson for mr johnson said: ""the mayor believes strongly that paying the london living wage makes good business sense as it helps to boost the bottom line by building dedicated and motivated workforces.""

the research was carried out by jane wills, a professor of geography at queen mary, university of london.

she said 55% of those interviewed said it was difficult to manage their household expenses.

one said they spent half of their wages on repaying debt, while others said they worked very long hours.

enhance office cleaning introduced the wage in 2010.

sandy aird, its managing director, said the company believed it was ""morally right"" to do so.

he added the company now had a lower staff turnover due to the wage increase.

bharat mehta, chief executive of trust for london, said: ""government can save nearly â£1bn a year in london if companies in the capital pay the living wage; workers receive thousands more in wages and employers can reap hr, reputational and efficiency benefits.

""this means there is no reason for large numbers of companies to pay poverty wages in the capital.

""paying the living wage gives people fair reward for the work they do and helps to tackle poverty and inequality in one of the most unequal cities in the developed world.""",cleaning,not mentioned
https://www.bbc.co.uk/news/av/uk-england-london-43518477,Games Workshop: The empire that began in a west London flat,2018,"today, games workshop is a multi-million pound business beloved by board game and wargaming fans around the globe.

forty years since its launch, co-founders and best friends ian livingstone and steve jackson share the story of its humble beginnings.",not mentioned,not mentioned
https://www.bbc.co.uk/news/uk-england-london-37985033,London Underground workers balloted over strikes in ticket closure safety row,2016,"london mayor sadiq khan has ordered a review of the ticket office closures

hundreds of london underground (lu) workers are to be balloted over strike action in a row about safety.

members of the transport salaried staffs' association (tssa) said its members had been subjected to increased threats and abuse since a programme of ticket office closures started.

the result of the vote is due at the end of november threatening strikes in the run up to christmas.

an lu spokesman said it does tolerate any form of assault on its staff.

a survey for the tssa said most of the 540 staff felt less safe since they moved from ticket offices on to station concourses.

the union said staff were being targeted by frustrated passengers if ticket machines do not work.

the ticket officers were closed as part of the fit for the future programme introduced by former london mayor boris johnson.

his successorsadiq khan has ordered a review of the project.

tssa leader manuel cortes said: ""my members say fit for the future working practices are fit for nothing and should be scrapped.

the first ticket offices closed in february last year

""they are overstretched by the rosters, stressed by how unsafe the tube has become and fed up with the spikes in abuse, both verbal and physical, from passengers.""

lu's steve griffiths said: ""everyone has the right to go about their work without fear or intimidation and we do not tolerate any form of verbal or physical assault on our staff.

""our campaign against workplace violence sends a clear message that any assault on staff will be fully investigated and we work closely with the british transport police to bring perpetrators to justice.""

the first ticket offices closed in february 2015 and transport for london said the plan would save â£50m annually.",not mentioned,british
https://www.bbc.co.uk/news/articles/c8ew0jrjxz9o,Could we be seeing the end of working from home?,2025,"some employers have started to enforce new rules that see staff in the office five days a week

flexible working arrangements to allow staff to work from home are being restricted or brought to an end by some employers with offices based in london.

companiesinitiated remote working during the pandemic, and many have retained a flexible working policy.

however, some firms, such as amazon, are requiring staff toreturn to the office five days a weekbut there have been reports that staff have made anonymous complaints online about the policy.

amazon boss andy jassy wrote to staff in september to say office working allowed it to ""better invent, collaborate and be connected enough to deliver the absolute best for customers and the business"".

the policy was due to begin with the return to work in january, however, an insider told the bbc they were not able to enforce the five days-a-week rule due to a current lack of desk space.

amazon has disputed this and said all employees were back in the office full-time.

amazon is not alone in asking employees to return to office working.

the metropolitan police has introduced a new hybrid working policy which requires civilian staff to work a minimum of three days a week in the office.

intelligence analyst anna bruce-hou, who has worked at home three days a week since covid, is one of more than 5,000 staff affected. she is vice-president of the public and commercial services (pcs) union and is one of the 2,400 members of who have begun industrial action in protest at the policy.

speaking to bbc london, she said working in the office for an extra day a week ""would have a negative impact on my ability to do my job"".

""in my office there are four desks and seven people, and even now with the reduction in office attendance i can struggle to find a desk,"" she said.

anna bruce-hou, an intelligence analyst for the met police, is fighting against losing her right to work at home three days a week

the metropolitan police said the policy, which came into effect on monday, ""did not end working from home"" and that it was aware some staff may have legitimate reasons for not following the policy due to agreed reasonable adjustment or an approved existing flexible working plan.

""our plans will provide consistency across the met and ensure we can deliver for our communities. we urge our staff and the union not to take further action,"" a spokesperson said.

they added that those who continued to work from home for more than two days a week might be in breach of their contract and could lose pay.

within the last year, a number of large london-based employers have reviewed their working policies and restricted or banned working from home.

wpp, a global communications agency, announced on tuesday it was tightening its rules and would require staff to be in four days a week from april.

ceo mark read said to staff in a letter: ""the data from across wpp agencies shows that higher levels of office attendance are associated with stronger employee engagement, improved client survey scores and better financial performance.""

he added: ""more of our clients are moving in this direction and expecting it of the teams who work with them.""

it has also been reported,externalthat a number of other large employers in london have asked some staff to return to five days a week in the office, but some firms have told the bbc the return-to-office policies only applied to certain teams.

david palmer, an employment lawyer, said there was no law stopping companies bringing staff in to the office five days a week

the question of how and whether to enforce employees to spend more time in the office is one that is being debated by companies across the capital.

david palmer, an employment lawyer at law firm addleshaw goddard, told the bbc that over the last six months, he had seen an increase in the number of queries from businesses who were considering a mandate in returning to the office.

""there's no law against a general policy that says employees must come in and work five days a week in their office, but there are considerations around reasonable adjustments for those with disabilities, consideration of indirect discriminations risks,"" he said.

mr palmer added the main consideration for companies should be ""the attraction and retention of talent"" and that would ""depend on business to business"".

could staff monitors via surveillance cameras be used by companies to ensure staff are at their desks?

companies wishing to bring staff into the office more permanently are now considering the best ways to ensure staff are present.

asurvey of 150 financial services companies,externalwas conducted in september last year by kpmg, which found that bosses were considering a range of methods to track attendance in the office.

companies said they would consider using monitoring devices, such as cameras in the office or even under-desk sensors to ensure employees were at work.

for some companies though, incentives are being used to encourage employees back into the work place instead.

just eat for business, who ask staff to be in the office three days a week, offer an allowance for free food every month.

managing director matt ephgrave said the idea was ""very affordable"" for the firm.

""we're all human, so it creates a moment where you can sit down, you can have a conversation with people you might not otherwise speak to,"" he said.

maddie scoular at just eat for business said she really missed coming into the office

the centre for citiesconducted research into londoners returning to the office,externalin september last year.

it reported: ""central london office workers have continued to return to the office since last year.

""days in for full-time workers have increased from 2.2 days in spring 2023 to 2.7 in summer 2024.""

but, it said london's return to the office had been ""slow by global standards"".

property consultancy firm bidwells surveyed 400 employers in london last april and found that the commute to work was one of the main disincentives for going into the office.

mark callender, who worked on the research, said of those surveyed: ""what we see is most people going into office on tuesday, wednesday and thursday.

""but, on a monday it's only half and on a friday it's even lower, it's about 40%.""

he added: ""a lot of it does have to do with time spent commuting, over a third of people in london said it takes them more than an hour.""

listen to the best of bbc radio london onsoundsand follow bbc london onfacebook,external,x,externalandinstagram,external. send your story ideas tohello.bbclondon@bbc.co.uk,external",not mentioned,not mentioned
https://www.bbc.co.uk/news/av/uk-england-london-35597334,Illegal skin lightening creams being sold in London,2016,"illegal skin-whitening creams are being sold by high street cosmetics shops despite a number of prosecutions,a bbc undercover investigation has revealed.

shaba hair and cosmetics stores have been fined for dealing in creams containing hydroquinone, but researchers found outlets continuing to sell them.

products containing hydroquinone can damage the liver and nervous system.

trading standards officials said there was ""no excuse"" for selling the creams. shaba refused to comment.",not mentioned,not mentioned
