URL,Title,Date,Text
https://www.bbc.co.uk/sport/football/articles/ce8q01d56v7o,2026 World Cup 'Pride Match' to feature Egypt and Iran,2025-12-08T10:22:30.981Z,"2026 World Cup 'Pride Match' to feature Egypt and IranImage source,BBC Sport/Getty ImagesImage caption,Egypt and Iran have been drawn in 2026 World Cup Group G alongside Belgium and New ZealandByEmma SmithBBC Sport journalistPublished8 December 2025A 2026 World Cup fixture designated by organisers as an LGBTQ+ 'Pride Match' will feature two countries where homosexuality is illegal.The local organising committee in Seattle, one of the host cities for the Fifa tournament next summer, have said the match at the city's Lumen Field on 26 June will feature celebrations of the LGBTQ+ community.The plans were put in place before the teams involved in the fixture were selected or the draw for the 2026 World Cup was made.And following Friday's draw and Saturday's fixture allocation, it has been confirmed that the game on 26 June in Seattle will be the Group G match between Egypt and Iran.In Iran, the maximum punishment for homosexual relations is the death penalty, while in Egypt, morality laws are frequently usedto suppress LGBTQ+ rights and relationships.To play this video you need to enable JavaScript in your browser.This video can not be playedMedia caption,How was the fixture selected?The event - which is organised solely by the local committee and is not affiliated with Fifa - will take place on the Friday of Seattle's official Pride weekend, with artists in Washington stateinvited to submit designs of artwork,externalcelebrating LGBTQ+ people for display around the game and city.The Seattle Pride Match Advisory Committee, set up by organisers to help with the event, say the game will still go ahead as planned.A spokesperson told LGBT news outletOutsports:,external""The Pride Match has been scheduled to celebrate and elevate Pride events in Seattle and across the country, and it was planned well in advance.""Soccer has a unique power to unite people across borders, cultures, and beliefs. We are honoured to host a Pride Match and to celebrate Pride as part of a global football community.""This match reflects our ongoing commitment to respect, dignity, and unity for all.""It is not the first time an attempted gesture of support for LGBTQ+ people at the World Cup has run into issues.At the 2022 World Cup in Qatar -which also has laws against same-sex relationships- Fifa said players that wore the OneLove armband in support of LGBTQ+ people would receive yellow cards.England and Wales were among the teams who had planned to wear the band, butdecided against itfollowing Fifa's ruling.BBC Sport has contacted Fifa, the Seattle organising committee and the Egyptian and Iranian Football Associations for comment.Related topicsEgyptIranFootballFIFA World CupMore on this storyFollow your club with BBC SportPublished17 OctoberListen to the latest Football Daily podcastAttributionSoundsGet football news sent straight to your phonePublished16 August"
https://www.bbc.co.uk/news/articles/cjw2yw51pn0o,Suspected illegal workers arrested at pick-up spot,2025-03-12T16:12:32.393Z,"Suspected illegal workers arrested at pick-up spotImage source,PA MediaImage caption,Officers from the Home Office Immigration Enforcement team helped to arrest nine peopleBySarah Spina-MatthewsBBC News, YorkshirePublished12 March 2025A group of suspected illegal workers have been arrested as they waited at a ""pick-up point"" in Bradford, the Home Office has said.Nine men were detained by immigration enforcement officers at the junction of Naples Street and Whetley Lane as they waited to be driven to jobs on construction sites and in warehouses and distribution centres.The Home Office and West Yorkshire Police were acting on intelligence that the location was regularly used for the purpose.One of the men was found to have already failed an application for asylum and has been detained pending deportation.The employers of the men will also be investigated while the police will look into potential driving offences connected to the operation.Dame Angela Eagle, minister for border security and asylum, said: ""Immigration rules must be respected and enforced to stop the abuse of our borders, vulnerable people and the economy.""Authorities promised there would be ""further crackdowns"" on pick-up hotspots.Get in touchTell us which stories we should cover in YorkshireContact formContact formListen to highlights fromWest Yorkshire on BBC Sounds, catch up with the latestepisode of Look North.Related topicsBradfordMore on this storyIllegal workers told 'you will be arrested'Published28 FebruaryIllegal worker arrests in Midlands up by thirdPublished10 FebruaryIllegal workers held in raids on nail bars and takeawaysPublished10 FebruaryRelated internet linksHome Office"
https://www.bbc.co.uk/news/articles/cwyez0y6kvlo,"Illegal working in UK was unbearable, migrant says",2025-03-11T01:08:29.430Z,"Illegal working in UK was unbearable, migrant saysImage source,JOSIE HANNETT / BBCImage caption,Five months after arriving in the UK Gzim decided to return to AlbaniaByJosie Hannett & Alex BishBBC South East Investigations TeamPublished11 March 2025An Albanian national who travelled to the UK illegally has told the BBC how his life became ""unbearable"" after he ended up working on a cannabis farm.Gzim, who wished to remain anonymous, was one of more than 12,600 Albanians who made the trip to the UK by small boat in 2022 - the peak year forEnglish Channel migrant crossings.Last year the number of Albanians that made the dangerous journey dropped to just 616 people, following a campaign by the UK and Albanian governments.Gzim says he is speaking out to warn others, as the UK government relaunches a social media campaign aimed at warning Albanians who enter illegally of possible hardships in the UK.He says he found a smuggler on TikTok who agreed to help him make the journey to England, and after travelling to France via buses, he arrived in Dunkirk, where a boat was launched to Dover.He says his cousins, who were already in the UK, paid the smuggler Â£3,500 for him to cross the channel.After being placed in a hotel, he says he was able to leave unnoticed to work on a cannabis farm.He said: ""I wanted a better life, to help my family, like all the other people who have done this journey.""I knew the risks involved with this kind of business, but I hoped that I wouldn't be unlucky.""Image source,Josie Hannett / BBCImage caption,For some time, the northern Albanian city of KukÃ«s was known as a 'ghost town' because many left for the UKHe says the cannabis farm was broken into and because of this he didn't get paid.Gzim moved into a construction role where he says he felt forced to take a lower wage - not enough to cover his own expenses and support his family back home.Five months after arriving in the UK he said it got so ""unbearable"" he decided to return to Albania.He added: ""I dreamed of other things. I hoped I would make it.""Nobody wants to leave his homeland. Nobody wants to leave his people and his friends. But in Albania it is a war of survival and I didn't have any other choice.""How many people cross the Channel in small boatsNewsocial media,externaladverts are highlighting stories of migrants who entered the UK illegally ""only to face debt and exploitation"".This approach originally started in 2023 under the Conservative government.It followeda cooperation agreement,externalsigned by the UK and Albania under the previous government to try and reduce illegal migration.The numbers on small boats had already started to fall before the agreement was struck.The National Crime Agency said the reduction in crossings is due toa number of different factors,external, including law enforcement activity, deportations, diminished demand for travel to the UK and potential displacement to other methods.Last year more than 2,600 people were returned to Albania, more than any other nationality.Image source,Josie Hannett / BBCImage caption,Lavdrim Krashi is an MP in the ruling Socialist PartyBalkans expert Andi Hoxhaj told a committee of MPs in 2022 that he estimated about 40% of people leave Albania for ""economic opportunities"".Lavdrim Krashi, an MP in the ruling Socialist Party, said some people had been lured on social media by promises of a better life in Britain.He told the BBC: ""The promotion was made to especially young people to come to the UK and if you make it there, don't worry about any finances because money really grows on trees, and we know that's not the case.""The numbers travelling illegally has drastically reduced in the last few years, but always more can be done,"" he said.""It's not in our interest to lose our young people, we want to make them thrive in the Albanian economy.""Families left behindBut there are also ongoing concerns about Albanians being trafficked into the UK.They are still among the most common nationalities referred to theNational Referral Mechanism,externalas potential modern day slaves.Jorida Tabaku, an opposition MP from the Democratic Party said: ""When people go there they face a different reality.""A lot of them are paying very much to go to the UK, a lot of them are leaving families behind because they are unemployed men.""Image source,Josie Hannett / BBCImage caption,Jorida Tabaku, an MP from the Democratic Party, has warned about trafficking from her countryAlbanian TV journalist Eraldo Harlicaj says depopulation of the country has been an issue for years.""We have lots of problems here again.""Nothing has changed about Albania from 2022 when we had the peak of illegal migration,"" he said.""Most of the young Albanians who wanted to go to England are in England, so we don't have any more to send.""Since 2022 the British Embassy has invested Â£6m in a project aimed at stemming the flow of people leaving northern Albania for a life of illegal working in the UK.The New Perspectives programme is designed to create job and business opportunities.Vasyl Chornyi, the team leader, said: ""There are organised criminal groups using their social media, trying to lure people into trafficking scheme.""Trying to change the narrative with a positive image that people can make their life here is extremely important,"" he added.The project provides business mentoring and coaches people in employment and entrepreneurship skills.Image source,BBC Josie HannettImage caption,Albert Halilaj is Mayor of the KukÃ«s Municipality in northern AlbaniaAlbert Halilaj, the Mayor of KukÃ«s said: ""The number of immigrants going abroad is falling down. The young people of KukÃ«s are not looking to migrate anymore.""Tourism is the sole focus of the future of KukÃ«s, and i'd like to make a public call to all the immigrants abroad that they can return here and they will find support for their investments in every field.""Image source,Josie Hannett / BBCImage caption,Saimir Boshnjaku is head of the Albanian Border and Migration PoliceThe migration agreement with Britain has also resulted in closer co-operation to tackle people smuggling.Head of the Albanian Border and Migration Police, Saimir Boshnjaku, said: ""Albanian law enforcement officers have been deployed in the UK, especially in Dover, to support the British authorities"".A network of UK-funded cameras has also been installed on the Albania-Kosovo border to tackle illegal migration and criminal gangs.The equipment includes afleet of drones,externaland number plate recognition cameras to recognise British vehicles which criminals use to avoid detection by the local police.Minister for Europe, Stephen Doughty said: ""By working directly with Albanian communities, we are discouraging the dangerous journeys to the UK.""Together with tougher border controls and cracking down on people-smuggling gangs, the government is focused on the international challenge and delivering on its Plan for Change.""Additional reporting by Miguel Roca-Terry and Jonathan Fagg, BBC News.Follow BBC Kent onFacebook,external, onX,external, and onInstagram,external. Send your story ideas tosoutheasttoday@bbc.co.uk,externalor WhatsApp us on 08081 002250.Related topicsForeign & Commonwealth OfficeHome OfficeAlbaniaDoverNew deals with Balkan states to target people smugglersPublished7 November 2024Home Office starts ad campaign to deter AlbaniansPublished28 May 2023Are fewer Albanian migrants coming to the UK?Published8 March 2023Related internet linksHome OfficeForeign, Commonwealth and Development Office"
https://www.bbc.co.uk/news/articles/cpv4k837xg8o,British workers 'undercut by illegal immigrants',2025-03-06T06:00:25.439Z,"British workers 'undercut by illegal immigrants'Image source,Getty ImagesImage caption,Hartlepool's Labour MP Jonathan Brash believes a blind eye is being turned to the issue of illegal immigrationByPhilippa Goymer,ÂBBC North East & Cumbria InvestigationsÂandÂCalum Grewar,ÂBBC North East & Cumbria InvestigationsPublished6 March 2025Fines for employing immigrants illegally have been issued in Cumbria and the north-east of England at a rate 25% higher than the UK average.Some 150 firms - mainly takeaways, restaurants, car-washes and barber shops - have been told to pay more than Â£2m in the last five years, according toHome Office data,external.The penalties ranged from Â£10,000 to Â£90,000, and 11 businesses have been fined more than once.The Labour MP for Hartlepool, Jonathan Brash, said: ""British workers are being undercut by illegal immigrants.""Using Office for National Statistics data for the number of local business units, the rate at which fines were issued from July 2019 to September 2024 can be calculated.Across the UK, about 1 in 1,200 companies received a fine; in the North East and Cumbria that figure was 1 in 960. In Hartlepool, a town of 90,000 people, more than 1 in 250 firms were fined.One - Marmaris Barber in Guisborough - is still trading despite having to pay out Â£80,000.The shop confirmed it was still giving haircuts but did not respond to further requests for comment.Image caption,Marmaris Barber in Guisborough was fined Â£80,000 for employing illegal workersBrash said a blind eye had been turned to the issue and that Hartlepool was a place already struggling when it came to employment and its local economy.""We can't afford to be undercutting British workers,"" he said.""It is something we've got to crack down on. It is in plain sight.""I have no issue with people coming here to work but they have to do it legally.""The government said, since it came into power in July last year,arrests and illegal working visitsby enforcement officers had gone up 38% compared with the same period 12 months previously.The chairman of Reform UK's Sunderland Central branch, Chris Eynon, said the government needed to do ""way more"".""We don't have a clue about how many illegal workers are actually in the North East and that's part of the problem,"" he said.""We have a crisis of unemployment.""We need to get British people who've lived here and paid in to the system for many years, they need to be going for these jobs not people who shouldn't be working illegally.""Immigrants and asylum seekersIllegal working laws apply not only to those who are in the UK illegally, but also to those who are allowed to be in the country but cannot work, such as asylum seekers.When someone claims asylum, they are provided with basic accommodation and usually just under Â£50 per week.However, if their claim is refused, they may be permitted to stay but can no longer receive any public money, or money from any employment.Image caption,Pete Widlinski of the Mary Thompson Fund says he understands why people still work despite not being allowed to do so.Pete Widlinski, who co-founded the Teesside-based Mary Thompson Fund whichsupports asylum seekers, said he understood why some people might take work despite not being allowed to do so.In many cases, after having an asylum claim refused, ""you're still legally allowed to be in the UK"", he said.""So they have every right to be here but they've got nothing.""You can understand that the least worst thing they can do is working illegally, rather than go robbing, burglary, or mugging people in the street.""The minister for border security and asylum, Dame Angela Eagle, said people coming to the UK have often been sold false promises.""This ends up with unscrupulous employers undercutting law-abiding businesses and exploiting migrant workers, often treating them in inhumane ways,"" she said.""That's why, as part of our plan for change, we are cracking down on illegal working at every level to end the abuse of vulnerable people, the immigration system and our economy.""Follow BBC North East onX,externalandFacebook,externaland BBC Cumbria onX,externalandFacebook,externaland both onNextdoorandInstagram,external.Get in touchDo you have a story suggestion for BBC North East & Cumbria?Contact formContact formRelated topicsUK immigrationImmigrationHartlepoolCumbriaMore on this storyImmigration explained: Migrants, refugees, and visas definedPublished27 FebruaryHow many people cross the Channel in small boats?How many people come to work and study in the UK?Facts on migrants key to cohesion â charity bossPublished27 FebruaryCitizenship plan 'puts me on blacklist' - refugeePublished22 FebruaryRelated internet linksOffice for National StatisticsHome OfficeMary Thompson Fund"
https://www.bbc.co.uk/news/articles/cq6y276p743o,Illegal workers told 'you will be arrested',2025-02-28T05:58:52.242Z,"Illegal workers told 'you will be arrested'Image source,Georgia Poncia/BBCImage caption,Tano Grima, South East ICE (Immigration Compliance Enforcement) team lead, says they have stepped up enforcementByAlex Bish & Georgia PonciaBBC South East Investigations TeamPublished28 February 2025""If anyone is thinking of entering the UK illegally to work, don't do it,"" says Tano Grima from the Home Office's South East immigration and enforcement team.""Immigration officers will come for you and you will be arrested,"" he told BBC South East.Joining immigration staff on a series of operations the BBC was told they have even found young teenagers suspected of working illegally.Mr Grima, South East Immigration Compliance Enforcement team lead said: ""If you're employing people without the permission to work, you will be fined.""He said: ""Quite recently my officers encountered a 17-year-old listed as missing by social services.""Illegal working is a driver for illegal migration. It's a pull factor.""Image source,Home OfficeImage caption,Home Office teams carrying out enforcement visits in the South EastBetween July, when Labour came into power, and 31 January, 3,930 arrests were made during more than 5,424 visits around the UK by immigration enforcement officers, the Home Office said.A total of 1,090 civil penalty notices were also issued, with employers facing potential fines of up toÂ£60,000,externalper worker if found liable.The government says those arrested for illegal working made the journey to the UK through a mix of routes, including by crossing the Channel, and by overstaying legitimately-granted visas.Home Office minister, Dame Angela Eagle, said: ""Under our Plan for Change, we're ramping up enforcement activity to record levels to send a clear message that there is no hiding place from the law.""But Reform UK leader Nigel Farage recently described the figures released by the government as feeble, compared with the numbers that had entered the country.Home Office enforcement teams say their visits to work places are intelligence led, following information from a number of sources, partners and the public.During recent operations in the South East, three Romanians were arrested at a factory in east Kent on suspicion of working in breach of their entry conditions and overstaying.In north Kent, five Indian nationals were arrested at a takeaway shop on suspicion of overstaying their visa.Three men - two Indian and one Afghan national - were detained at a restaurant in West Sussex on suspicion of overstaying and working in breach of bail conditions.Meanwhile, in East Sussex a man and a woman from India were arrested at a takeaway on suspicion of immigration offences.'Trending upwards'Across the UK, enforcement teams raided 828 premises including nail bars, car washes, and restaurants and made 609 arrests in January 2024 - a 73% increase on January 2023.Peter Walsh, head of theMigration Observatory,externalat the University of Oxford, said: ""Visits to businesses and arrests in January are up , but that's only one month, so we should be cautious about inferring too much from a single month.""He said more than 1,000 civil penalty notices were issued to employers over the first seven months of the Labour government.""That is more than in recent years, although they were already trending upwards from historic lows after the pandemic.""They're still below levels seen a decade ago,"" Mr Walsh said.""Raids can only ever target a small share of the total businesses employing unauthorised workers.""Image source,Georgia Poncia/BBCImage caption,Justine Carter is from Unseen which runs the national Modern Day Slavery HelplineJustine Carter, the executive director of Unseen, the anti-slavery charity running Modern Slavery Helpline, said: ""I think it is about sending a tough message.""But, when you think about the thousands of pounds that are used for these types of raids, the very few people who are identified as a result is a real concern.""She says it is crucial that enforcement teams also identify potential slavery victims.""For victims forced or coerced into either travelling or working against their will, or against their visa requirements, it's really important that we can recognise those people, and that they can come forward and seek the help and support they need and deserve.""Ms Carter said: ""It's critical we send a tough message to employers.  It's about illegal practices within legitimate supply chains.""Follow BBC Kent onFacebook,external, onX,external, and onInstagram,external. Send your story ideas tosoutheasttoday@bbc.co.uk,externalor WhatsApp us on 08081 002250.Related topicsHuman traffickingMigrationMore on this story'Slavery gang masters beat us for fun'Published4 July 2024Modern slavery backlog could be 'eradicated' in two yearsPublished18 October 2024McDonaldâs and supermarkets failed to spot slaveryPublished30 September 2024Related internet linksHome Office"
https://www.bbc.co.uk/news/articles/c4gpw6v6r14o,Illegal worker arrests in Midlands up by third,2025-02-10T13:18:53.472Z,"Illegal worker arrests in Midlands up by thirdImage source,Getty ImagesImage caption,The Home Office said immigration enforcement teams in the Midlands searched more than 100 sitesByAndrew DawkinsBBC News, West MidlandsPublished10 February 2025More than 100 migrants were arrested in a month in the Midlands as part ofa UK-wide crackdown on illegal working, the government said.In January, 131 sites were raided in the region with 106 arrests, a 34% rise on the same month in 2024.Across the UK, arrests in the month rose to 609, a 73% increase and a Home Office spokesperson said staff searched 828 premises including nail bars and car washes.Home Office Minister Dame Angela Eagle said the government had put out footage of some raids in an effort to send a message with ""imagery as well as words"".Illegal workers held in raids on nail bars and takeawaysPublished10 FebruaryThe Home Office spokesperson said a significant proportion of January's raids were at restaurants, takeaways and cafes.Employers could face a fine of up to Â£60,000 per worker if found liable.Later, the government's Border Security, Asylum and Immigration Bill will be debated in the House of Commons in its second reading.The bill aims to introduce a raft of new offencesand counter terrorism-style powers to clamp down on people smugglers bringing migrants across the Channel.Shadow Home Secretary Chris Philp called it a ""weak bill that won't stop the boats"".Get in touchTell us which stories we should cover in Birmingham and the Black CountryContact formContact formFollow BBC Birmingham onBBC Sounds,Facebook,external,X,externalandInstagram,external.Related topicsCoventry & WarwickshireDerbyshireMore on this storyIllegal workers held in raids on nail bars and takeawaysPublished10 FebruaryIllegal nail bar jobs offered despite clampdownPublished20 December 2024Car washes and beauty sector to be targeted over immigrationPublished21 July 2024Related internet linksHome Office"
